full_text,normalized
"morning moots🌅 aku hari ini sama besok kayaknya ngga bisa jbjb dulu, soalnya mau simulasi tka. minta doanya semoga lancar yaa t___t buat moots aku nyang agit juga semangat yapp&lt;3",morning moots aku hari ini sama besok kayaknya tidak bisa jbjb dulu soalnya mau simulasi tka meminta doanya semoga lancar ya tt buat moots aku nyang kelas tiga juga semangat yapplt
semoga kita semua yg harus ngerjain tka ini dapet pahala exclusive😔😔😔😔😔😔😔😔😔😔😔😔😔😔😔😔😔😔😔,semoga kita semua yang harus ngerjain tka ini dapat pahala exclusive
"Hari ini abis Gladi TKA trus Bimbingan Kartul, dan KBM masih berlangsung aja, p mkst. Pusink. Hueueu. Ada wawancara juga, diwawancarai dan ngewawancara hahshahshdj. Terus NGEPRINT, DEYMMMMMM",hari ini habis gladi tka terus bimbingan kartul dan kbm masih berlangsung saja p maksud pusink hueueu ada wawancara juga diwawancarai dan ngewawancara hahshahshdj terus ngeprint deym
"selamat pagi, selamat mengikuti gladi tka lagi🤢🥴😭🤗",selamat pagi selamat mengikuti gladi tka lagi
aku gladi tka gelombang 2 😢 ga siap jujur……,aku gladi tka gelombang tidak siap jujur
hari ini gladi bersih TKA.....,hari ini gladi bersih tka
Menjelang TKA bener2 dahhh diforsir ini mah gue😭,menjelang tka benar sudah diforsir ini mah gue
"buset dah, anjer baru liat apaan itu TKA, untung udah lulus njir (8 years ago🗿)
semangat ya adick² kelas 12",buset sudah anjer baru lihat apaan itu tka untung sudah lulus anjir years ago semangat ya adick kelas
"apkah tka itu nyata, w berharap di h-7 tka ini ada kabar tka dibatalin hmmm",apkah tka itu nyata gue berharap di h tka ini ada kabar tka dibatalin hm
kerjain dulu tka mu itu adek😠❤️,kerjain dulu tka mu itu adek
"guten morgen oll, semangat untuk yang hari ini gladi TKA eaa🤗🤗🤗🤗",guten morgen oll semangat untuk yang hari ini gladi tka eaa
"udah emosi banget sama tka, bikin ritme belajar utbkku hancur",sudah emosi banget sama tka bikin ritme belajar utbkku hancur
"Asli y kdng pas nembak feeling w bnr jir, kek sometimes dr semua jawaban di mata w ada yg warnanya IJO BENDERANG gt eh bener, kemarin TO TKA matwa banyak nembak dpt 600 an",asli ya kadang pas menembak feeling gue benar jir kayak sometimes dari semua jawaban di mata gue ada yang warnanya ijo benderang begitu eh benar kemarin try out tka matwa banyak menembak dapat an
"Eh tapi gwe jg salah si, ngide silf riwird, TKA AJA MINGDEP",eh tapi gwe juga salah sih ngide silf riwird tka saja mingdep
UDAH YUK MAIN TKA TKAAN NYA 💔,sudah yuk main tka tkaan nya
udah sakit strees tka GINI BANGET KLS 12 LULUSAN COVID KURIKULUM MERDEKA TBTB TKA UJI COBA BUET DAH,sudah sakit strees tka begini banget kelas lulusan covid kurikulum merdeka tbtb tka uji coba buet sudah
"guys, ada yang tau ga to TKA dimana lagi? 😥😥☝🏻",guys ada yang tau tidak try out tka dimana lagi
kok sekolahku belum ngasih jadwal tka yah ;&lt;,kok sekolahku belum mengasih jadwal tka ya lantai
"gelombang &amp; sesi simulasi tka sama yang TKA beneran nya sama ngga ya
di simulasi aku dapet gel 1 sesi 3, mana jam segitu jam ngantuk ngantuk nya 😞",gelombang   sesi simulasi tka sama yang tka benaran nya sama tidak ya di simulasi aku dapat gel sesi mana jam segitu jam ngantuk ngantuk nya
"guys monday, simulasi tka…gua kira tka hanya mitos",guys monday simulasi tkagua kira tka hanya mitos
"mau nangis, hari ini aku ngerjain to tka inten. jujur aku rasa soalnya gak se sulit to 1. lalu aku ngerjain 45 latsol sosio dengan nilai beda beda. semoga aja SEMOGA YA. jujur kepikiran juga sama progress aku gimana ya Allah pengen nangis banget kaya FUCK TKA DEMI TUHAN",mau menangis hari ini aku ngerjain try out tka inten jujur aku rasa soalnya tidak se sulit try out lalu aku ngerjain latihan soal sosio dengan nilai beda beda semoga saja semoga ya jujur kepikiran juga sama progress aku bagaimana ya allah pengin menangis banget kaya fuck tka demi tuhan
"aku habis debat sm mamaku karna aku blg di sekolah jamkos gaada pelajaran, lumayan wasting time buat urgensi tka, tp mamaku gangerti &amp; malah ngira aku males2 an gamau masuk sekolah pdhl aku dirumah mau belajar mandiri ngejar tka, bingung bgt :((",aku habis debat sama mamaku karena aku bilang di sekolah jamkos tidak ada pelajaran lumayan wasting time buat urgensi tka tapi mamaku gangerti   malah ngira aku malas an tidak mau masuk sekolah padahal aku dirumah mau belajar mandiri ngejar tka bingung banget
"kmren2 tmn2 gue degdegan mau tka, gue baru kerasa SEKARANG😀😀😭😭😭😭",kemarin teman gue degdegan mau tka gue baru kerasa sekarang
"udah capek-capek TKA masa ga keterima jalur snbp, rugi dong (keterima pilihan 1, AAMIIN 🤲🏻)",sudah capekcapek tka masa tidak keterima jalur snbp rugi dong keterima pilihan amin
"Minggu depan aku absen hype h2h ya bessss, maafkaaannn dan doakan tka aku lancar😔🙏🏻

HEAD 2 HEAD SERIES EP1

#H2HseriesEP1",minggu depan aku absen hype hh ya bes maafkan dan doakan tka aku lancar head head series ep hhseriesep
Gmna cra ny ak kerasukan isaac newton di hari H tka fisika😞,bagaimana cra nya aku kerasukan isaac newton di hari h tka fisika
Sori sori aje nih bos @L_MarshaJKT48,sori sori saja nih bos
"h-seminggu tka
gue masi berharap tka tiba tiba ditiadain 😊",hseminggu tka gue masih berharap tka tiba tiba ditiadain
"Sialan.... Aku pengen buat sesuatu buat honami karena dia hari ini ulang tahun, tapi aku hari ini banget harus sibuk sama TO TKA.... Badan aku udah enggak kuat untuk ngelakuin hal lain selain belajar buat TKA 🫩 sorry honami my beloved.... 🥹",sialan aku pengin buat sesuatu buat honami karena dia hari ini ulang tahun tapi aku hari ini banget harus sibuk sama try out tka badan aku sudah enggak kuat untuk melakukan hal lain selain belajar buat tka sorry honami my beloved
oj loqk mfal qe tka hup barcelona amo hajde jom tut prit jasht e kem ni motel ngat e folmi aty,oj loqk mfal qe tka hup barcelona amo hajde jom tut prit jasht e kem nih motel ngat e folmi aty
infokan kunci dan pembahasan to tka sainsin pls,infokan kunci dan pembahasan try out tka sainsin tolong
"Kenapa di dunia ada TKA yah, bukannya PTN dan segalanya itu milik Tuhan",kenapa di dunia ada tka ya bukannya ptn dan segalanya itu milik tuhan
TKA ternyata bukan cerita rakyat,tka ternyata bukan cerita rakyat
How I ended up sick 2 kali dalam seminggu gara gara mikirin TKA.,how i ended up sick kali dalam seminggu gara gara memikirkan tka
wOI WOAKAOWKAOAK WOIIII NILAI TO TKA SAMA UTBK GUE JELEK BWNGETTT 😭😭😭😭😭😭,woi woakaowkaoak woi nilai try out tka sama utbk gue jelek bwnget
"HAII, selamat pagii🌞 hari ini aku simulasi tka pliss takut bangett🥹🥹",hai selamat pagii hari ini aku simulasi tka pliss takut banget
"Semua tangisan gua takut nilai rapor dan rangking turun dan bakal dihujat sama ortu kalau ga sesuai ekspetasi mereka, jadi ga berguna karena dua hari tka",semua tangisan gua takut nilai rapor dan rangking turun dan bakal dihujat sama orang tua kalau tidak sesuai ekspetasi mereka jadi tidak berguna karena dua hari tka
"senin udah gladi tka
SENIN UDAH GLADI TKA",senin sudah gladi tka senin sudah gladi tka
Aku ada ngajar TKA di salah satu sekolah. Terus ada murid sekelas yang namanya sama-sama ada Mada dan Gio 😭 aku jadi ingat au ku yang belum selesai-selesai ituuu😭🫵,aku ada mengajar tka di salah satu sekolah terus ada murid sekelas yang namanya samasama ada mada dan gio aku jadi ingat au ku yang belum selesaiselesai itu
"harusnya tuh skrg lagi belajar utbk, tka merusak segalanya",harusnya tuh sekarang lagi belajar utbk tka merusak segalanya
"ABIS TKA LSP, ABIS LSP UAS matilah kita",habis tka lsp habis lsp uas matilah kita
"Besok ngurus rujukan ke RS, ke Superindo, bikin soal latihan buat tka, nyetrika, ngebabu... Ngapain lagi ya",besok mengurus rujukan ke rs ke superindo bikin soal latihan buat tka nyetrika ngebabu mengapai lagi ya
aku gladi tka rabuu... semangat yang gladi hari senin 🤲🏻,aku gladi tka rabuu semangat yang gladi hari senin
belum juga tka gue udh kepikiran self reward,belum juga tka gue sudah kepikiran self reward
nilai TKA harus lebih gede dari nilai TO,nilai tka harus lebih gede dari nilai try out
"Beneran mau nanya ini mah, di TKA MATWA bakal ada limit limitan?",benaran mau bertanya ini mah di tka matwa bakal ada limit limitan
"GAWAT hrni gladi n besok bersih tka😊😊, semangat semuanya 💪🏻💪🏻",gawat hrni gladi n besok bersih tka semangat semuanya
kita smua tka itung kancing sembari dzikir aja gaksih nanti kalo jelek satu negara kan salah pemrenta,kita semua tka itung kancing sembari dzikir saja gaksih nanti kalau jelek satu negara kan salah pemrenta
semoga 2 minggu kedepan sampe tka selesai aman damai tentram,semoga minggu kedepan sampai tka selesai aman damai tentram
entah aku se stress itu sama TKA atau engga... bahkan tidur tambahan 10 menit aja tadi mimpiin TKA,entah aku se stres itu sama tka atau tidak bahkan tidur tambahan menit saja tadi mimpiin tka
"MAN TEMANNN, siapa punya rekomendasi playlist yt buat belajar tka math?? or yt channel yg enak buat dimarathonin?",man teman siapa punya rekomendasi playlist yt buat belajar tka math atau yt channel yang enak buat dimarathonin
"habis tka banget yaa bang, janlup mulung guys💃🏻",habis tka banget ya abang janlup mulung guys
HARI INI DRILL TKA YA ALLAH TAKUT BANGETTT,hari ini drill tka ya allah takut banget
mood belajar apapun kecuali TKA&lt;/3,mood belajar apapun kecuali tkalt
bentar lagi tka gini malah drop :),bentar lagi tka begini malah drop
eh sumpah kata gua tka cepet kelar deh sumpah gaguna gua udh bnr bnr mau fokus utbk aja anjir,eh sumpah kata gua tka cepat kelar deh sumpah gaguna gua sudah benar benar mau fokus utbk saja anjir
siganteeenggg 😩😩😩💭⭐⭐⭐🫰🏻🫰🏻🫰🏻🫰🏻😭💤🤤 beso doain aku yaaa gantengggg beso gladi tka aku bubbbbssss 😡🫰🏻,siganteng beso doain aku ya ganteng beso gladi tka aku bubs
Bismillahirrahmanirrahim ya Allah semoga gladi bersih tka ini lancar 🥹🥹😭,bismillahirrahmanirrahim ya allah semoga gladi bersih tka ini lancar
gw yakin survive tka kecuali mtk sumpah,gue yakin survive tka kecuali matematika sumpah
"Lagi scroll scroll, mikirin enaknya beli apa ya buat self reward abis TKA, malah keinget besok Senin 😡",lagi scroll scroll memikirkan enaknya beli apa ya buat self reward habis tka malah teringat besok senin
sekolah aku ngadain event tgl 28 oktober pdhl agit awal november TKA...🥰🥰,sekolah aku mengadakan event tanggal oktober padahal kelas tiga awal november tka
semtuju biarpun aku belum tka,semtuju biarpun aku belum tka
kirain tka cuma cerita rakyat,mengira tka cuma cerita rakyat
siapa yang hari ini gladi tka 🙋🏻‍♀️🙋🏻‍♀️,siapa yang hari ini gladi tka
"aku nyoba simulasi TKA sosiologi yg dari Pusmendik, syok bngt cuma salah 1 dari 20 soal??!😭😭🫶🏻",aku mencoba simulasi tka sosiologi yang dari pusmendik syok banget cuma salah dari soal
Simulasi TKA kalian lancar atau amburadul guys? ptn!,simulasi tka kalian lancar atau amburadul guys
ASTAGFIRULLAH TKA TUH REAL,astagfirullah tka tuh real
"semangat buat yang uts hari ini, especially si merah ku ini @vancouvecr 
dan semangat simulasi tka nyah, gadis gadisku nyang cantik @Lengkxra @chamapani @8flome 
love you🩵",semangat buat yang uts hari ini especially sih merah ku ini dan semangat simulasi tka nya gadis gadisku nyang cantik love you
SEMANGAT ADIK-ADIK YANG TKA❤️❤️❤️❤️❤️❤️❤️❤️❤️❤️❤️,semangat adikadik yang tka
"aku sbg guru yg urus TKA juga mikir gini, ternyata real ya 🤡

persiapan dari agustusss sampe bosen ya allah semangat ya anak2 😭🥹",aku sebagai guru yang urus tka juga mikir begini ternyata real ya persiapan dari agustus sampai bosan ya allah semangat ya anak
SEMOGA SOAL TKA SEGAMPANG LATSOL DI BISADANEDU AAMEEEEENNNN,semoga soal tka segampang latihan soal di bisadanedu aamen
yangg berpikiran ngadain TKA syapaa? mwww akk labrak pakai kekuatan duyungg 🙄,yangg berpikiran mengadakan tka syapaa mau aku labrak pakai kekuatan duyungg
"Semoga besok gladi bersih tka lancar, soalnya gelombang satu sesi satu 😭😭😭",semoga besok gladi bersih tka lancar soalnya gelombang satu sesi satu
"pagii guys hari ini aku simulasi tka di sekolah, minta doanya semoga lancar dan hasilnyaa memuaskan dari awal sampai hari h 🫰🏻  buat moots aku yg agit juga semangat yaaa 😼",pagii guys hari ini aku simulasi tka di sekolah meminta doanya semoga lancar dan hasilnyaa memuaskan dari awal sampai hari h buat moots aku yang kelas tiga juga semangat ya
"TIFOSI BERSINAR!!
bentar mau nyiapin jj buat sw",tifosi bersinar bentar mau nyiapin jj buat sw
"Semoga besok dapet sesi 1 simulasi TKA biar bisa memantau X nya papi dengan tenang, takut dia up catalog",semoga besok dapat sesi simulasi tka biar bisa memantau kali nya papi dengan tenang takut dia up catalog
serius ini udah encok bgt pls be nice tka,serius ini sudah encok banget tolong be nice tka
😭😭😭😐😐😐 jangan tanya keadaan ku besok pas simulasi TKA gmn..,jangan tanya keadaan ku besok pas simulasi tka bagaimana
Sengga fokus itu buat belajar TKA ternyata aku salah satu siswa eligible terus lulus snbp di UPNVJ ga jadi ikut snbt terus tentram tinggal nunggu ospek ( andai masuk UPN semulus hayalan ku ),sengga fokus itu buat belajar tka ternyata aku salah satu siswa eligible terus lulus snbp di upnvj tidak jadi ikut snbt terus tentram tinggal menunggu ospek andai masuk upn semulus hayalan ku
"guys wta, gladi bersih tka tuh wajib gasih?",guys wta gladi bersih tka tuh wajib tidak sih
siap mgebantai tka atau gua yg dibantai? 💀💀💀,siap mgebantai tka atau gua yang dibantai
"hope its not. soal to inten gendeng kabeh. 2to tka pola inten dan 2 to tka wajib + pilihan, BAHKAN SOAL DI MODUL TKA APALAGI YG MTK AAARGHHDJDJJE soal e kabeh ra ngotak. IM REALY GOING BALD 😢😢😢😢😢😢😢😢😢😢",hope its not soal try out inten gila kabeh try out tka pola inten dan try out tka wajib pilihan bahkan soal di modul tka apalagi yang matematika arghhdjdjje soal e kabeh ra ngotak im realy going bald
guys wajar ga kalo nilai tka kecil... beneran... udah se hopeless itu aku jir,guys wajar tidak kalau nilai tka kecil benaran sudah se hopeless itu aku jir
Hari ini gladi bersih TKA aaaaaaaaaaa ;-;,hari ini gladi bersih tka a
Kayaknya mending aku lanjut belajar TKA aja deh,kayaknya mending aku lanjut belajar tka saja deh
ini udh h-brp tka dah gua gd semangat yg membara ni,ini sudah hbrp tka sudah gua gd semangat yang membara nih
1 like maka tka dibatalkan,like maka tka dibatalkan
Good morning from me who stayed at home karena simulasi tka dan jadwalku rabu kamis YEYYY....yey💔,good morning from me who stayed at home karena simulasi tka dan jadwalku rabu kamis yeyey
"hari ini gladi tka 😭😭
tka batalin aja pls demi aku 😭😭",hari ini gladi tka tka batalin saja tolong demi aku
"POKOKNYA ABIS TKA, GUE MAU HEALING, MAU BACA AU SEPUASNYA, MAU HIBERNASI TITIK.",pokoknya habis tka gue mau healing mau baca au sepuasnya mau hibernasi titik
sch! guyss ada yg punya catatan rumus rumus materi tka matwa sama mat tl ga yaa??,guys ada yang punya catatan rumus rumus materi tka matwa sama mat tl tidak ya
ptn! guys saran dong web paling murah buat to TKA premium,guys saran dong web paling murah buat try out tka premium
"ya Allah iya lagi😭😭latsol mtk ku beneran cuma 50an, mentok2 naik 10 jadi 60 (atleast Alhamdulillah) tapi semoga tka nya 90++++",ya allah iya lagilatsol matematika ku benaran cuma an mentok naik jadi atleast alhamdulillah tapi semoga tka nya
nilai TKA ngaruh gasih sama nilai UTBK? ptn!,nilai tka ngaruh tidak sih sama nilai utbk
ya Allah demotiv 💔💔 ga mood belajar tka 💔 h-6 burnt out 💔💔,ya allah demotiv tidak mood belajar tka h burnt out
"@MemeComicIndo Yg dibutuhkan sekolah-sekolah negeri tuh internet &amp; perangkat komputer yang layak untuk ANBK (Asesmen Nasional Berbasis Komputer) &amp; TKA (Tes Kemampuan Akademik), yg datang malah smart tv 😞",yang dibutuhkan sekolahsekolah negeri tuh internet   perangkat komputer yang layak untuk anbk asesmen nasional berbasis komputer   tka tes kemampuan akademik yang datang malah smart tv
"dari yang awal awal semangat ambis tka terus sekrang aku gaada motivasi dan mulai cape gara gara banyak tugas.. bahkan minggu depan udah tka pun hari ini aku ada presentasi sama ulangan, gila",dari yang awal awal semangat ambis tka terus sekarang aku tidak ada motivasi dan mulai capek gara gara banyak tugas bahkan minggu depan sudah tka pun hari ini aku ada presentasi sama ulangan gila
niatnya progress mau abis tka tp to-4 katanya seminggu setelah tka anjirrr udh gda waktu progress 😭😭😭,niatnya progress mau habis tka tapi try out katanya seminggu setelah tka anjir sudah tidak ada waktu progress
"Sch! Sumpah ya, mendikdasmen bkin sistem tka khususnya mtk 1 soal 2 menit tpi bntuk soalnya cerita tuh target muridnya siapa sih anjr?? Org gila mana yg bisa ngerjain dlm 2 menit dgn bntuk soal seliterasi itu",sumpah ya mendikdasmen bikin sistem tka khususnya matematika soal menit tapi bntuk soalnya cerita tuh target muridnya siapa sih anjr orang gila mana yang bisa ngerjain dalam menit dengan bntuk soal seliterasi itu
"Sch! Down banget setelah TKA, LEBIH DOWN LAGI SETELAH TAU BANYAK YANG CURANG😭😭😭",down banget setelah tka lebih down lagi setelah tau banyak yang curang
"riview singkat tka hari ini…. JELEK BANGET PERSIAPANNYA SUMPAH. ADA YANG HP AN SAAT PELAKSANAAN PADAHAL ADA PENGAWAS, ITUPUN KAGAK KETAHUAN😭 dan btw untuk matematika nya kebanyakan soal geometri. soal fungsi, peluang, transformasi dikit puolll cuma ada 2-3 soal.",riview singkat tka hari ini jelek banget persiapannya sumpah ada yang hp an saat pelaksanaan padahal ada pengawas itupun kagak ketahuan dan btw untuk matematika nya kebanyakan soal geometri soal fungsi peluang transformasi dikit puol cuma ada soal
"hai tudey aku ultah, tolonk ucapin bwat menghibur diriku di tengah hecticnya TKA ini🥺",hai tudey aku ultah tolonk mengucapkan bwat menghibur diriku di tengah hecticnya tka ini
kalian lebih pusingin TKA atau SNBT? ptn!,kalian lebih pusingin tka atau snbt
iri bgt sm 27 jir. di sklhku udh bnr bnr ganti susunan bab gitu kyk mostly buat persiapan tka. la nasip gwehj ini gmn..materi kls 12 ori blm kelar udh ditabrak materi tka..pdhl bsk US ASPD pake materi kls 12 yg biasa………APSIHHH,iri banget sama jir di sklhku sudah benar benar ganti susunan bab begitu kayak mostly buat persiapan tka lah nasip gwehj ini gmnmateri kelas orisinal belum kelar sudah ditabrak materi tkapdhl besok us aspd pakai materi kelas yang biasaapsih
"diliat-liat akhir tahun ini banyak moots yg sibuk ya? entah ujian, tka, kerja, etc. SEMANGATTT",diliatliat akhir tahun ini banyak moots yang sibuk ya entah ujian tka kerja etc semangat
teman teman semangoy h-7 tka😔🤲🏻,teman teman semangoy h tka
skrng mikirnya gimana cara biar sertif tka nanti ga nyampe ke ortu soalnya bagus ga bagus tetep aja gabakal ada yg puas,sekarang mikirnya bagaimana cara biar sertif tka nanti tidak sampai ke orang tua soalnya bagus tidak bagus tetap saja tidak bakal ada yang puas
besok mau share rangkuman tka biologi ke sini deh,besok mau share rangkuman tka biologi ke sini deh
"Teman-teman maaf ya jarang jb-jb, karena lagi belajar buat tka dan ke pressure banget aduh. Semangat buat kalian yaa angkatan 26, pasti biza 🙌🏻🌸",temanteman maaf ya jarang jbjb karena lagi belajar buat tka dan ke pressure banget aduh semangat buat kalian ya angkatan pasti bisa
RANGKUMAN MATERI BIOLOGI TKA,rangkuman materi biologi tka
"jujur udh di fase nyerah sama tka 
TAPI AKU GAMAU SERTIFIKATKU ADA ANGKA JELEK 😭😭😭😭😭😭",jujur sudah di fase nyerah sama tka tapi aku tidak mau sertifikatku ada angka jelek
"yaallah keren, tugas numpuk gini temenku masih mikirin ngajar dan ngurus TKA juga. kalau ak sih udh gk kuat 😭😭😭😭",yaallah keren tugas numpuk begini temenku masih memikirkan mengajar dan mengurus tka juga kalau aku sih sudah tidak kuat
"Anjirrr dh muak liat soal² TO, lagi capek²ny belajar gara² TKA, n pas buka twt trus bacain komen² akt lain yg ga ngerasain nih sistem ikut komen alay or lebay pas ada yg ngeluh nyelekit juga y (bjir time to sleep aj lah soalny dh mulai ngena)",anjir dah muak lihat soal try out lagi capekny belajar gara tka n pas buka twt terus bacain komen angkatan lain yang tidak merasai nih sistem ikut komen alay atau lebay pas ada yang ngeluh nyelekit juga ya bjir time try out sleep saja lah soalny dah mulai ngena
"hari ini gladi tka pada error, masih ada harapan tka dicancel h-1 🤲",hari ini gladi tka pada error masih ada harapan tka dicancel h
buten! seberapa mirip soal to tka inten dengan simulasi kemarin gengs?,seberapa mirip soal try out tka inten dengan simulasi kemarin gengs
"udah minggu depan tka, gabisa nonton the blaze, exo gajadi ot9. emg manusia kuat bgt ak inih",sudah minggu depan tka tidak bisa menonton the blaze e gajadi ot memang manusia kuat banget aku ini
prri lg tka juga ya makanya depresi jg,prri lagi tka juga ya makanya depresi juga
sorry aja ga takut tka punya allah😊🤲🏻,sorry saja tidak takut tka punya allah
"tka eko sm
pkk gue bomat dem",tka eko sama pakai gue bomat dem
"after tka pasti rsj penuh, belum mulai tka aja udah gila sendiri anjirrr 😔✋🏻",after tka pasti rsj penuh belum mulai tka saja sudah gila sendiri anjir
infokan soal gladi tka fisika dan/atau mat tl pls🥰🥰,infokan soal gladi tka fisika danatau mat tl tolong
makin deket hari h tka makin jenuh belajar makin burnout anjirrrr,makin dekat hari h tka makin jenuh belajar makin burnout anjir
tka ekonomi ternyata sesulid itu.......,tka ekonomi ternyata sesulid itu
wdyt abt pembatalan tka h-7?🤔🤔,wdyt abt pembatalan tka h
"Halo kak, maybe km bukan angkatan 26, aku izin ngasih sedikit informasi tambahan kenapa anak angkatan 26 banyak yg ngeluhin TKA

1. Materi di setiap sekolah tidak sama dan kurikulum beda-beda, ada yg masih K13 ada yg udah kurmer. Seperti di sekolahku, untuk fisika ini materi -",halo kak kayak kamu bukan angkatan aku izin mengasih sedikit informasi tambahan kenapa anak angkatan banyak yang ngeluhin tka materi di setiap sekolah tidak sama dan kurikulum bedabeda ada yang masih ke ada yang sudah kurmer seperti di sekolahku untuk fisika ini materi
sbnrnya masih wondering apa si urgensinya tka harus bgt di akt 26.. klo mau buat snbp knp ga awal thn aja kyknya lebih selo..apa buat akt 27 sekalian……just why ajg,sbnrnya masih wondering apa sih urgensinya tka harus banget di angkatan kalau mau buat snbp kenapa tidak awal tahun saja kayaknya lebih seloapa buat angkatan sekalianjust kenapa ajg
"coba yg bisa baca tarot, ramal dong kapan TKA dibatalkan",coba yang bisa baca tarot ramal dong kapan tka dibatalkan
"Buset, sampe ada petisi. Emang apa deh urgensinya sampe dibikin petisi? se enggak krusial itukah adanya TKA?",buset sampai ada petisi memang apa deh urgensinya sampai dibikin petisi se enggak krusial itukah adanya tka
h-7 tka dan kita semua masih denial,h tka dan kita semua masih denial
gw skrg liat buku TKA langsung mual cok,gue sekarang lihat buku tka langsung mual cok
"lu tau ga si 2,5 thn gua perjuangin nilai rapot tbtb tka muncul gt aja gaada pesiapan kisi kisi ga jls jumlah soal ga jelas juga sakit hati anjing mending lu suruh utas ato ga aud yg ikut tka anj jangan agik gini sialan",kamu tau tidak sih tahun gua perjuangin nilai rapot tbtb tka muncul begitu saja tidak ada pesiapan kisi kisi tidak jls jumlah soal tidak jelas juga sakit hati anjing mending kamu suruh utas atau tidak aud yang ikut tka anjing jangan agik begini sialan
"Hallo teman ambis, aku kebetulan ada latsol TKA Fisika dan Bahasa Indonesia yang dibuat sama guru Fisika dan Bahasa Indonesia di sekolahku. Ada yang mau? Kalau ada, say hello aja yah di cuitan ini :3",halo teman ambis aku kebetulan ada latihan soal tka fisika dan bahasa indonesia yang dibuat sama guru fisika dan bahasa indonesia di sekolahku ada yang mau kalau ada sayang hello saja ya di cuitan ini
ptn! guys kalian peduliin tka ga sih.....,guys kalian mempedulikan tka tidak sih
pagii! hari ini sekolahku GLADI BERSIH TKA 🤚🏻🧍🏻‍♀️🥝,pagii hari ini sekolahku gladi bersih tka
LAH SISTEM PENILAIAN TKA ITU KALO SALAH -1 POIN???? katanya ga ada pengurangan nilai,lah sistem penilaian tka itu kalau salah poin katanya tidak ada pengurangan nilai
"semoga tahun depan udah gak ada TKA, tahun sekarang bodo amat hmmzz",semoga tahun depan sudah tidak ada tka tahun sekarang bodo amat hmmzz
"tbh petisi TKA jg gak serius anjir itu jokes doang, tp tante tante kurang kerjaan nyebelin bgt ngapesih!!",tbh petisi tka juga tidak serius anjir itu jokes doang tapi tante tante kurang pekerjaan menyebalkan banget ngapesih
Stress bgt soal tka ya Allah mau nangis rasanyaaa,stres banget soal tka ya allah mau menangis rasanya
meninggal seems easier than ngerjain TKA,meninggal seems easier tahan ngerjain tka
"RIBET, DARIAWAL EMANG GAJELAS NI TKA",ribet dariawal memang tidak jelas nih tka
apa yg hrs gw lakukan di h-7 tka ini.....,apa yang harus gue lakukan di h tka ini
"sekolahku be fucking real lah, tka udah h- berapa tapi anak kelas 12 masih disuruh ikut lomba bulbas 🙄",sekolahku be fucking real lah tka sudah h berapa tapi anak kelas masih disuruh ikut lomba bulbas
"sebagai org yg kena utbk tka &amp; non tka dan udh tingkat 3, lu aja ege",sebagai orang yang kena utbk tka   non tka dan sudah tingkat kamu saja ege
Mbb ya kakk! Terimakasih banyakk,mbb ya kak terimakasih banyakk
