full_text,normalized
ada rekomen buku tka gaa,ada rekomen buku tka tidak
Habis mewarisi buku utbk dan rangkuman TKA ke adek gweh... Kok cepet bgt ya,habis mewarisi buku utbk dan rangkuman tka ke adek gweh kok cepat banget ya
ini bneran sklh ku gda info apa² tentang tka??!!,ini benaran sekolah ku tidak ada info apa tentang tka
Mending ke dokter aja kalo perkara balapan mobil doang bilang nyawa “cuma”,mending ke dokter saja kalau perkara balapan mobil doang bilang nyawa cuma
Kalau andaikan saya jadi siswa kelas 12. Saya akan menganggap TKA itu salah satu latihan untuk UTBK karena seluruh materi wajib yang ada di TKA juga merupakan subtest untuk UTBK. Istilahnya kalau di himpunan tuh materi TKA merupakan himpunan bagian dari seluruh subtes di UTBK.,kalau andaikan saya jadi siswa kelas saya akan menganggap tka itu salah satu latihan untuk utbk karena seluruh materi wajib yang ada di tka juga merupakan subtest untuk utbk istilahnya kalau di himpunan tuh materi tka merupakan himpunan bagian dari seluruh subtes di utbk
guys mending buku gercep TKA atau kompeten TKA ya?,guys mending buku gercep tka atau kompeten tka ya
hah tka udh h-100🙂🙂🙂🙂 perasaan kmren baru h-150an..,hah tka sudah h perasaan kemarin baru han
"sch! aku niatnya mau ambil manajemen dan kebijakan publik, mapel pilihan buat tka nya apa yaa",aku niatnya mau ambil manajemen dan kebijakan publik mata pelajaran pilihan buat tka nya apa ya
Untuk yang kali ini aku beneran gak ikut ikutan. Aku kooperatif.,untuk yang kali ini aku benaran tidak ikut ikutan aku kooperatif
mending belajar buat tka dlu atau utbk yaa? huhu,mending belajar buat tka dulu atau utbk ya huhu
"mutss maap ya jarang jbjb, diriku enih sibux belajar buat tka &amp; snbp 😔😔😔",mutss maaf ya jarang jbjb diriku enih sibux belajar buat tka   snbp
"guis... untuk agit, mulai belajar tka dan snbt drmn yah... aku mau mulai tp bingung, TRS TIPS dong supaya g bosen pas belajar",guis untuk kelas tiga mulai belajar tka dan snbt darimana ya aku mau mulai tapi bingung terus tips dong supaya tidak bosan pas belajar
"Guys aku mau nanya nih, kan tadi TKA aku di b. ing error dan gabisa masuk lagi ke dalam soalnya, padahal ada 2 soal yang belum kejawab 😔, dari yang kalian tau semisalnya gabisa masuk lagi ke dalam soalnya, kira-kira jawaban",guys aku mau bertanya nih kan tadi tka aku di b ing error dan tidak bisa masuk lagi ke dalam soalnya padahal ada soal yang belum terjawab dari yang kalian tau semisalnya tidak bisa masuk lagi ke dalam soalnya kirakira jawaban
eh to gratis yg lagi buka apa deh skrg 😔 (yang bukan tka),eh try out gratis yang lagi buka apa deh sekarang yang bukan tka
"ptn! aku niatnya mau ambil jurusan administrasi fiskal atau ga administrasi bisnis, kira-kira mapel minat tka yang sesuai apa ya di antara:
1. eko matmin
2. eko sosio
mohon pencerahannya, ya! aku bingung banget",aku niatnya mau ambil jurusan administrasi fiskal atau tidak administrasi bisnis kirakira mata pelajaran minat tka yang sesuai apa ya di antara eko matmin eko sosio mohon pencerahannya ya aku bingung banget
ingin cepat cepat dewasa tapi takut dengan TKA,ingin cepat cepat dewasa tapi takut dengan tka
temeeen temen ada rekomendasi buku buat belajar snbt 2026 dan tka gaaak ya t___t,teman teman ada rekomendasi buku buat belajar snbt dan tka tidak ya tt
"Ini konsep SMA skrg gimana si cok, nanya adek gw dia juga gajelas jelasinnya. ada UN atau engga, tka tka buat kelulusan atau apa atau gimana gajelas asu",ini konsep sama sekarang bagaimana sih cok bertanya adek gue dia juga tidak jelas jelasinnya ada un atau tidak tka tka buat kelulusan atau apa atau bagaimana tidak jelas asu
"kenapa ga ada yg ngasih tau agit secape ini 😔😔, aku uda nangis kaya… ya Allah kenapa aku harus tka",kenapa tidak ada yang mengasih tau kelas tiga secape ini aku sudah menangis kaya ya allah kenapa aku harus tka
Buat nyicil catetan TKA mending langganan Pahamify atau RG yaa?,buat mencicil catetan tka mending langganan pahamify atau rg ya
"Emang simulasi TKA seserius itu, gue sih ngga peduli ya",memang simulasi tka seserius itu gue sih tidak peduli ya
"guru""dah ngomongin ptn sm tka berkali""yaAllahh MAKIN ADA TEKANAN RASANYA💔💔",gurudah mengomongkan ptn sama tka berkaliyaallahh makin ada tekanan rasanya
Guys yg pake TKA buat thn depan tu yg snbp aja atau utbk juga sih?,guys yang pakai tka buat tahun depan itu yang snbp saja atau utbk juga sih
"saran dong gue tka mending ngambil
-biologi kimia🤏🏻
-biologi fisika🤏🏻

bingung beut anjir gue cuman bisa biologi bgst",saran dong gue tka mending ngambil biologi kimia biologi fisika bingung banget anjir gue cuman bisa biologi bgst
"guys mau nanya dong, TKA tuh berapa soal sihhh per mapel??",guys mau bertanya dong tka tuh berapa soal sih per mata pelajaran
"sumpah ya, semenjak sekolah ini bener² ga ada waktu buat belajar tka/utbk.. sekolah isi nya tugas sama pr semua astaga.. tiap hari tiap mapel ada tugas &amp; pr semua gile.. mendingan libur kata gue mah 🫵🫵",sumpah ya semenjak sekolah ini benar tidak ada waktu buat belajar tkautbk sekolah isi nya tugas sama pr semua astaga tiap hari tiap mata pelajaran ada tugas   pr semua gila mendingan libur kata gue mah
ptn! kalo mau masuk jurusan matematika tp mapel pilihan tka aku matematika &amp; bing masih bisa ngga ya? secara bing kan bkn mapel pendukung jurusan matematika,kalau mau masuk jurusan matematika tapi mata pelajaran pilihan tka aku matematika   bahasa inggris masih bisa tidak ya secara bahasa inggris kan bukan mata pelajaran pendukung jurusan matematika
"buten! ini inten belum mulai belajar TKA yang november itu kah? masih materi sekolah yg sekarang dulu? terus matrikulasi nya untuk kelas grade belum, ini emang pirtondi aja atau semua nya juga? ada info ga kapan?",ini inten belum mulai belajar tka yang november itu kah masih materi sekolah yang sekarang dulu terus matrikulasi nya untuk kelas grade belum ini memang pirtondi saja atau semua nya juga ada info tidak kapan
"Kelas TKA FAcademy Launching Besok. 

Ada Kelas :
1. TKA Matematika
2. TKA Matematika Lanjut

Waktunya di Weekend, sehingga temen² pasti bisa hadir. 😁",kelas tka facademy launching besok ada kelas tka matematika tka matematika lanjut waktunya di weekend sehingga teman pasti bisa hadir
hai sch! adakah diantara kalian yang punya study group?? butuh temen belajar TKA 😔 kalau bisa yang sering ngasih latsol/materi yah!,hai adakah diantara kalian yang punya study group butuh teman belajar tka kalau bisa yang sering mengasih latsolmateri ya
"moots, kalian belajar TKA di manaa?? pake apaa??",moots kalian belajar tka di manaa pakai apa
"hai gais, tolong relomendasiin aku buku buat tka sma dongg, terimakasi gaiss ♡",hai guys tolong relomendasiin aku buku buat tka sama dong terimakasi gaiss
capee bangett hari inii T-T semangat buat semua anak ang 26 tiap hari belajar 2 meteri (tka sama utbk),cape banget hari ini tt semangat buat semua anak ang tiap hari belajar meteri tka sama utbk
BUAT TKA PLS JANGAN SENTUH GAPYEAR🙏🏻🙏🏻🙏🏻,buat tka tolong jangan sentuh gapyear
"kelas 12, kalian udah mulai ngebagi waktu buat belajar TKA &amp; SNBT atau masih fokus belajar mapel di sekolah nih?",kelas kalian sudah mulai ngebagi waktu buat belajar tka   snbt atau masih fokus belajar mata pelajaran di sekolah nih
"sch! aku pgn langganan zeni 9/12 bln tapi budget ku baru bisa buat 3 bln sedangkan tka &amp; utbk semakin dekat, kira2 mending langganan sekarang 3bln atau 9bln tapi bulan depan (paling cepet) baru ke kumpul?",aku pengin langganan zeni bulan tapi budget ku baru bisa buat bulan sedangkan tka   utbk semakin dekat kira mending langganan sekarang bulan atau bulan tapi bulan depan paling cepat baru ke kumpul
"jujur temen’ ku pada pinter bgt, karena mereka ga masuk eligibel jadi pada pilih mapel yg mudah buat tka, moto mereka gpp ga snbp tapi tka nya gede 😭😭",jujur teman ku pada pintar banget karena mereka tidak masuk eligibel jadi pada pilih mata pelajaran yang mudah buat tka moto mereka tidak apa-apa tidak snbp tapi tka nya gede
"@futureapt Hai futureapt! Branding akunmu: StudyTwt santai ala siswa SMK Farmasi, campur motivasi kuliah, keluhan ujian (LSP/TKA), dan yapping bareng agit.

Rating: 8/10. Alasan: Bio jelas &amp; relatable, post konsisten tema sekolah/aspirasi farmasi, avatar lucu bikin fun. Minus: Kurang",hai futureapt branding akunmu studytwt santai ala siswa smk farmasi campur motivasi kuliah keluhan ujian lsptka dan yapping bareng kelas tiga rating alasan bio jelas   relatable post konsisten tema sekolahaspirasi farmasi avatar lucu bikin fun minus kurang
100 hari menuju TKA 🙂👊,hari menuju tka
"tka ada mapel pkn kah? kata guru pkn ku mapel buat pkn tka gada, sedangkan kata guruku yg lain ada🫠",tka ada mata pelajaran pkn kah kata guru pkn ku mata pelajaran buat pkn tka tidak ada sedangkan kata guruku yang lain ada
tadi disekolah habis sosialisali TKA dan aku jadi sedih bangettt.. ternyata aku udah mulai dewasa yaa,tadi disekolah habis sosialisali tka dan aku jadi sedih banget ternyata aku sudah mulai dewasa ya
"ptn! guys mau tanyaa, jurusan teknologi laboratorium medik itu kira kira belajarnya apaa ajaa yaa, trus prospek kerjanya gimanaa, sama kira kira mapel pendukungnnya buat TKA apa ajaa?",guys mau tanyaa jurusan teknologi laboratorium medik itu kira kira belajarnya apa saja ya terus prospek kerjanya bagaimana sama kira kira mata pelajaran pendukungnnya buat tka apa saja
kalian ada yang udah disuruh milih mapel buat tka belumm?,kalian ada yang sudah disuruh memilih mata pelajaran buat tka belumm
"Aku udah sampai di fase muak banget tiap denger guru ngomong soal ""kelas 12 sekolah cuma sekian bulan lagi"". Habis itu ulangan, TKA, uprak, US, try out, kuliah, dan bla bla bla. Di sekolah tadi aja aku sampai mual dengernya😭 kelas 12 sesibuk ini ternyata😭 maklum first time😭",aku sudah sampai di fase muak banget tiap dengar guru mengomong soal kelas sekolah cuma sekian bulan lagi habis itu ulangan tka uprak us try out kuliah dan bla bla bla di sekolah tadi saja aku sampai mual dengernya kelas sesibuk ini ternyata maklum first time
"Persiapan TKA Bahasa Inggris (Part 3): Strategi Ngerjain Soal Bacaan! 📄

Latih 3 teknik ini waktu baca soal panjang:

1. Skimming
Baca cepat buat dapetin gambaran umum isi teks.
Cukup perhatikan judul, kalimat pertama, dan akhir paragraf.

2. Scanning
Cari informasi spesifik",persiapan tka bahasa inggris part strategi ngerjain soal bacaan latih teknik ini waktu baca soal panjang skimming baca cepat buat mendapatkan gambaran umum isi teks cukup perhatikan judul kalimat pertama dan akhir paragraf scanning cari informasi spesifik
"ptn! gusy mau tanya kalo mau ambil psikologi, TKA better ngambil sosiologi+geografi atau sosiologi+ekonomi? n saran jurusan cadangannya dong dari gabungan mapel itu yg prospek kerjanya luas soalnya masih bimbang diantara keduanya itu",guys mau tanya kalau mau ambil psikologi tka better ngambil sosiologigeografi atau sosiologiekonomi n saran jurusan cadangannya dong dari gabungan mata pelajaran itu yang prospek kerjanya luas soalnya masih bimbang diantara keduanya itu
ptn! jadi aku mau ambil tka sosio-eko (mapel penjurusan aku soshum murni + bitl misal aku ambil psikologi (soshum)/ilmu administrasi oke ga ya? atau 2 mapel tu harus selinear sama 1 jurusan aja? tia 🤍,jadi aku mau ambil tka sosioeko mata pelajaran penjurusan aku soshum murni bitl misal aku ambil psikologi soshumilmu administrasi oke tidak ya atau mata pelajaran itu harus selinear sama jurusan saja tia
aku tuh disekolah sbnrnua nyicil belajar tka tapi ypt ku tidak di hp so sad 😔😔😔,aku tuh disekolah sbnrnua mencicil belajar tka tapi ypt ku tidak di hp sok sad
"stud! info skor utbk farmasi dan univnya dong kaka kaka, sama yang punya rekomend buku belajar utbk sama tka boleh kasih tau jugaa!!",info skor utbk farmasi dan univnya dong kakak kakak sama yang punya rekomend buku belajar utbk sama tka boleh kasih tau juga
bismillah mulai lagi nyicil materi tka dan utbk,bismillah mulai lagi mencicil materi tka dan utbk
BENERAN PAKET C AKU ADA TKA😭😭😭😭😭,benaran paket sih aku ada tka
ptn! sender masih ada akun mipi sampai bulan okt. itu tuh kalau ada update materi aplg untuk TKA akun kita msh ke update kah walaupun sisa 3 bulanan lg??,aku masih ada akun mipi sampai bulan okt itu tuh kalau ada update materi aplg untuk tka akun kita masih ke update kah walaupun sisa bulanan lagi
"guys mending langganan NF juara, skuling,atau pahamify buat belajar TKA n SNBT?",guys mending langganan nf juara skulingatau pahamify buat belajar tka n snbt
"guysss pliss, mending beli yg mana ya kalau mau belajar buat TKA, gercep, kompeten, atau the king TKA????🙏🏻🙏🏻🙏🏻, plisssss",guys pliss mending beli yang mana ya kalau mau belajar buat tka gercep kompeten atau the king tka tolong
"GILAAA....UDAH.... 
TKA.... 99 HARI LAGI.....
😭😭😭😭😭😭😭😭😭",gilaudah tka hari lagi
guys TKA emang ada remed yaa?? kok guruku bilang kalo gagal TKA bakal ada remed tapi harus ngeluarin rupiah😭 feeling aku hoax tapi mohon pencerahannya teman temann,guys tka memang ada remed ya kok guruku bilang kalau gagal tka bakal ada remed tapi harus mengeluarkan rupiah feeling aku hoax tapi mohon pencerahannya teman temann
"ptn! sender udah pasrah untuk snbp karena nilai nya kecil dan takut ga masuk eli, tapi ada tka, sender bimbang untuk tka ini gimana, dan kayaknya sekolah sender wajib ikut gini, atau ada saran lain...",aku sudah pasrah untuk snbp karena nilai nya kecil dan takut tidak masuk eli tapi ada tka aku bimbang untuk tka ini bagaimana dan kayaknya sekolah aku wajib ikut begini atau ada saran lain
"stud! ada yang punya materi tka gak yaa? anw sekalian apa ada yang mau temenan ma akuu? nanti kita bisa sharing info"" tka. tia! &lt;3",ada yang punya materi tka tidak ya anw sekalian apa ada yang mau berteman sama aku nanti kita bisa sharing info tka tia lantai
bingung bangey gue tka gak bisa matematikanya anjiing,bingung bangey gue tka tidak bisa matematikanya anjiing
guyss rekomendasi buku buat persiapan tka dong....😴😴🫰,guys rekomendasi buku buat persiapan tka dong
"sch! gais kalo misal TKA ambil 2 mapel peminatannya sosiologi dan geografi itu bisa ambil jurusan apa ya?
dan kalau sosiologi matematika tingkat lanjut itu bisa ke jurusan apa ya?
thank you gais!",guys kalau misal tka ambil mata pelajaran peminatannya sosiologi dan geografi itu bisa ambil jurusan apa ya dan kalau sosiologi matematika tingkat lanjut itu bisa ke jurusan apa ya thank you guys
"sch! halo aku punya saluran gitu latsol latsol kmren pas aku blajar utbk sama aku juga share share tentang materi tka disana, kali aja kalian mau nanti aku dm, thanks before!!",halo aku punya saluran begitu latihan soal latihan soal kemarin pas aku belajar utbk sama aku juga share share tentang materi tka disana kali saja kalian mau nanti aku dm thanks before
Kalo mata pelajaran pilihan TKA mending geografi atau sejarah?,kalau mata pelajaran pilihan tka mending geografi atau sejarah
"GUYSS AK KANGEN KALIAN BANGET HUEEE.. kangen jbjb ihh, jangan sapu ak pliss ak bakal banyak jbjb klo aku udh nganggur dan sudah bebas dari tka usbp snbt dll",guys aku kangen kalian banget hue kangen jbjb ih jangan sapu aku pliss aku bakal banyak jbjb kalau aku sudah nganggur dan sudah bebas dari tka usbp snbt dll
"Gua jawab dari sisi orang yg setiap hari berhubungan dengan mapel pertama:
1. Soal TKA bahasa Indonesia beda sama kisi-kisi (jauh banget)
2. Tiba2 soalnya ada campuran mapel kimia/kimia/fisika bagian literasi bacaan
3. Lagi-lagi kurikulum merdeka kagak jelas 🙏🏻",gua jawab dari sisi orang yang setiap hari berhubungan dengan mata pelajaran pertama soal tka bahasa indonesia beda sama kisikisi jauh banget tiba soalnya ada campuran mata pelajaran kimiakimiafisika bagian literasi bacaan lagilagi kurikulum merdeka kagak jelas
ikut tka ga ya.. huft,ikut tka tidak ya huft
"ptn! aku rencananya mau ambil jurusan psikologi (soshum)/ilmu komunikasi, jadi ujian TKA aku ambil sosiologi sama bahasa inggris tingkat lanjut, aman gak yaa? soalnya mapel minatku gaada ekonomi ataupun mtk tl",aku rencananya mau ambil jurusan psikologi soshumilmu komunikasi jadi ujian tka aku ambil sosiologi sama bahasa inggris tingkat lanjut aman tidak ya soalnya mata pelajaran minatku tidak ada ekonomi ataupun matematika tl
Ptn! misal sender nanti pilih mapel pilihan TKA matlan sm fisika ke teknologi informasi masih nyambung kn ya,misal aku nanti pilih mata pelajaran pilihan tka matematika lanjutan sama fisika ke teknologi informasi masih menyambung kan ya
"tapi soal TKA standar SBMPTN gitu emg gak bisa diharap buat rerata tinggi.. apalagi ini baru diadain lagi setelah sekian lama, mungkin aja pada culture shock sama soal2 yang ""hah ancrit susah banget""",tapi soal tka standar sbmptn begitu memang tidak bisa diharap buat rerata tinggi apalagi ini baru diadain lagi setelah sekian lama mungkin saja pada culture shock sama soal yang hah ancrit susah banget
"GA SABAR SEPTEMBER KARENA ADA HAECHAN SOLO😍🥳🥳🥳😍😆 TAPI TKA MAKIN MENDEKAT, H-1 BULAN TKA 😵😀🙃🤬😨😫😵‍💫😵🫨🫩",tidak sabar september karena ada haechan solo tapi tka makin mendekat h bulan tka
ptn! kira kira utbk 2026 itu sistem nya sama kek sebelumnya apa berubah ada TKA nya?,kira kira utbk itu sistem nya sama kayak sebelumnya apa berubah ada tka nya
"asesmen mulu yg diurus nih, tka dilupain aja",asesmen mulu yang diurus nih tka dilupain saja
sch! gusy boleh share jadwal belajar tka dan utbk kalian nggaa? tapi yang udah masuk sekolah dan udah pembelajaran seperti biasaa 🙌🏼🙏🏻,guys boleh share jadwal belajar tka dan utbk kalian nggaa tapi yang sudah masuk sekolah dan sudah pembelajaran seperti biasa
nahh gambaran soal TKA,nah gambaran soal tka
aku nemu kisi kisi tka full all mapell yang lebih pointed gitu ada yang mau gak 🤓🤓🤓,aku nemu kisi kisi tka full all mapell yang lebih pointed begitu ada yang mau tidak
Tiap malem selalu ovt bakal masuk univ mana…. Tka nanti gimana…. Ah capek bgt agit stress🥺🥺🥺🥺🥺🥺💔💔💔💔💔💔💔💔💔💔💔💔💔💔,tiap malam selalu ovt bakal masuk universitas mana tka nanti bagaimana ah capek banget kelas tiga stres
"hai hai hai, ada yang udah rangkum kisi2 TKA blm guyss😭😭",hai hai hai ada yang sudah rangkum kisi tka belum guys
kecewa bgt sm pengelompokkan jurusan &amp; sistem tka sekolah gua 😊,kecewa banget sama pengelompokkan jurusan   sistem tka sekolah gua
"sch! hai gaes, aku boleh minta saran engga kira"" aku harus mulai darimana buat bljr TKA, soalnya aku bingung banget dan ga tau harus mulai darimana, terimakasih banyak 🫰🏻💐",hai gaes aku boleh meminta saran tidak kira aku harus mulai darimana buat belajar tka soalnya aku bingung banget dan tidak tau harus mulai darimana terimakasih banyak
Najis ngpain gua ikut tka TKA HARAM KRNA MNYULITKAN UMAT MANUSIA #fisikagosong,najis ngpain gua ikut tka tka haram karena mnyulitkan umat manusia fisikagosong
mixue tuh bisa buat tempat nongkrong ga yaa? mau ngerjain tka di situ lama2 boleh gksie,mixue tuh bisa buat tempat nongkrong tidak ya mau ngerjain tka di situ lama boleh gksie
Gue ngga mau belajar untuk simulasi TKA tapi ngerasa kayak ngeganjel ARGHGHGGHHG tapi males banget gue tau ini ngga guna,gue tidak mau belajar untuk simulasi tka tapi merasa kayak ngeganjel arghghgghhg tapi malas banget gue tau ini tidak guna
"Yah ada TKA nanti, untung ada bocoran dari kakel gua walau gua masih aud boleh ikut atau ga",ya ada tka nanti untung ada bocoran dari kakel gua walau gua masih aud boleh ikut atau tidak
"Sch! TOLONG beri aku pencerahan mengenai buku-buku buat TKA (kompeten, gercep, gas pol, dll) sama SNBT(the king, p al faiz, paten, wangsit om jero, dll) , banyak banget jenisnya dan kurang tau plus minusnya🙏🏻🙏🏻🙏🏻🙏🏻",tolong beri aku pencerahan mengenai bukubuku buat tka kompeten gercep gas pol dll sama snbtthe king p al faiz paten wangsit om jero dll banyak banget jenisnya dan kurang tau plus minusnya
"Sch! Eh bnran ini MO TANYA, taon depan mentang2 ada tka, apakah utbk ada niatan dihapus? Kok tante saya yg guru SMA mikir kalo ada tka kemungkinan utbk di hapus???? Apa benar?",eh benaran ini mau tanya tahun depan mentang ada tka apakah utbk ada niatan dihapus kok tante saya yang guru sama mikir kalau ada tka kemungkinan utbk di hapus apa benar
tka berapa hari lagi si,tka berapa hari lagi sih
apa itu draft tka skripsi hari ini gua akan main 🥳🥳🥳,apa itu draft tka skripsi hari ini gua akan main
guys alternatif only utbk atau ada ga ya yg sm class tka nya?,guys alternatif only utbk atau ada tidak ya yang sama class tka nya
guys kalian sekarang lebih fokus belajar TKA apa utbk?,guys kalian sekarang lebih fokus belajar tka apa utbk
"sch! ada yg punya rekomendasi buku buat belajar TKA gaa, aku rencananya mau nunggu buku TKA nya om Jero tapi temenku saranin beli the king hmzmzmzmmz tambah bingung deh",ada yang punya rekomendasi buku buat belajar tka tidak aku rencananya mau menunggu buku tka nya om jero tapi temenku menyarankan beli the king hmzmzmzmmz tambah bingung deh
inimah kapan gua belajar tka snbt nya jir udh diserbu tugas💔💔🥀🥀 bitch💔💔😞,inimah kapan gua belajar tka snbt nya jir sudah diserbu tugas bitch
gue…. harus… mulaiii…. belajar…. TKA…. darimana😭😭😭TOLONGIN AKU TAKYT BGT,gue harus mulai belajar tka darimanatolongin aku takyt banget
"jd agit knpa pr makin banyak yh, mna dituntut belajar tka + snbt🤯
#sehatsehatagit",jadi kelas tiga kenapa pr makin banyak ya mana dituntut belajar tka snbt sehatsehatagit
"sch! infoin dong kalo mau ambil teknik industri di TKA harus banget ambil fisika ya? kalo ambil matlan sama kimia aja bisa ga sih?
bingung TKA ih😔",infoin dong kalau mau ambil teknik industri di tka harus banget ambil fisika ya kalau ambil matematika lanjutan sama kimia saja bisa tidak sih bingung tka ih
ini tka buat aktuaria tuh bnrn matlan sm FISIKA........?????,ini tka buat aktuaria tuh benaran matematika lanjutan sama fisika
HAH TKA UDAH H-90 AN?????????????,hah tka sudah h an
kata aku kalo udah kelas 12 kasi tugasnya jgn berat-berat sih.. SIBUK COY U KIRA KITA GA NYIAPIN TKA KAH,kata aku kalau sudah kelas kasih tugasnya jangan beratberat sih sibuk coy lu kira kita tidak nyiapin tka kah
"@luvieziaa Hai luvieziaa! Dari tweetmu yang fokus persiapan TKA/SNBT, catatan sosiologi, dan bahasa, Psikologi bisa cocok kok—karena melibatkan pemahaman perilaku manusia, mirip sosiologi. Kalau kamu suka analisis emosi &amp; sosial, ini bagus! Tapi pastikan passion-mu di situ. Gimana",hai luvieziaa dari tweetmu yang fokus persiapan tkasnbt catatan sosiologi dan bahasa psikologi bisa cocok kokkarena melibatkan pemahaman perilaku manusia mirip sosiologi kalau kamu suka analisis emosi   sosial ini bagus tapi pastikan passionmu di situ bagaimana
"sch! aku kan mau ke ptln tp harus ada plan b di ptn, mending ngejar tka or snbt?",aku kan mau ke ptln tapi harus ada plan b di ptn mending ngejar tka atau snbt
"sch! kan kelas 12 ini sibuk banget ya buat nyiapin tka sama snbt, nah kalau aku belajar snbt dan tka barengan gitu worth it gak yaa? kan di matematika wajibnya ada beberapa materi yang sama yaa? terima kasih",kan kelas ini sibuk banget ya buat nyiapin tka sama snbt nah kalau aku belajar snbt dan tka barengan begitu worth itu tidak ya kan di matematika wajibnya ada beberapa materi yang sama ya terima kasih
"aku kan rencana ambil ilkom ya, terus kebanyakan kata orang ambil sosio buat tka, tp krn aku smk jd ngga ada sosio, adanya sejarah dan b indo, mending aku ambil sejarah atau b indo tl nanti?",aku kan rencana ambil ilkom ya terus kebanyakan kata orang ambil sosio buat tka tapi karena aku smk jadi tidak ada sosio adanya sejarah dan b indonesia mending aku ambil sejarah atau b indonesia tl nanti
besok beneran mau belajar tka &amp; utbk,besok benaran mau belajar tka   utbk
"udh dapet pengumuman tka, yaAllah knps",sudah dapat pengumuman tka yaallah knps
Review buku tka the king dong.. bagus gak yaa? Atau ada saran buku TKA lainnya dan review nya jugaa stud!,review buku tka the king dong bagus tidak ya atau ada saran buku tka lainnya dan review nya juga
"sch! calling out pejuang ptn yang baru mau belajar SNBT/TKA tapi masih bingung sama kemampuan kalian gimana, atau kalian masih gatau mau belajar darimana??aku punya placement test gratis! dan bisa nentuin kemampuan kalian udah sampe mana☝ any interesting guys?",calling out pejuang ptn yang baru mau belajar snbttka tapi masih bingung sama kemampuan kalian bagaimana atau kalian masih tidak tau mau belajar darimanaaku punya placement test gratis dan bisa menentukan kemampuan kalian sudah sampai mana any interesting guys
"assalamualaikum snbp
assalamualaikum tka
assalamualaikum utbk 
assalamualaikum agit
bye bye kewarasanku",assalamualaikum snbp assalamualaikum tka assalamualaikum utbk assalamualaikum kelas tiga bye bye kewarasanku
"buten! aman ngga anak smk masuk di kelas lulus? btw di smk ku gaada pelajaran kimia, biologi, fisika, aku tka btw. takut bgt gabisa ngejar 😔",aman tidak anak smk masuk di kelas lulus btw di smk ku tidak ada pelajaran kimia biologi fisika aku tka btw takut banget tidak bisa ngejar
"📢 reminder❕
h-249 UTBK
h-94 TKA
AAA GASIAP PLSSS T____T",reminder h utbk h tka a gasiap tolong tt
"ptn! aku mau masuk psiko ui, buat tka nanti mending ambil mapel apa ya selain sosio?
mapel pendukung ku : geo, sejarah, bio, sosio
makassii sebelumnya^^",aku mau masuk psiko ui buat tka nanti mending ambil mata pelajaran apa ya selain sosio mata pelajaran pendukung ku geo sejarah bio sosio makassii sebelumnya
