full_text,normalized
"setiap belajar biologi keingat tka terus, GIMANA YA ANJAY SOALNYA ANALISA BGT BUAT GUA YANG LOGIKA NYA JARANG BENER TIAP JAWAB SOAL💔💔💔💔",setiap belajar biologi keingat tka terus bagaimana ya anjay soalnya analisa banget buat gua yang logika nya jarang benar tiap jawab soal
baru selesai belajar buat tka+ngerjain pr,baru selesai belajar buat tkangerjain pr
rehat abis tka sampe lupa mau review day 1 day 2 kemaren,rehat habis tka sampai lupa mau review day day kemarin
martin tka ambil minat apa,martin tka ambil minat apa
abis rehat dari tka saat nya lock in yutebeka,habis rehat dari tka saat nya lock ini yutebeka
Abis tka kenapa makin males belajar mapel sekolah ya... Mau nya belajar utbk aja pls😭😭,habis tka kenapa makin malas belajar mata pelajaran sekolah ya mau nya belajar utbk saja tolong
i bkann ghosting tauu i kena limitt tka leh reply dm,i bkann ghosting tau i kena limitt tka boleh reply dm
"setan siapasih yang bikin jadwal tka, viscam, CEQ BANGSAT ini sangat amat berdekatan 😅😅😅😅😅",setan siapasih yang bikin jadwal tka viscam ceq bangsat ini sangat amat berdekatan
Shum kllosharic moj Benite po kush kari tka njoft ty perpos logjikonomia qe tkan bo meme #bbvipks4,shum kllosharic moj benite po kush kari tka njoft ty perpos logjikonomia qe tkan bo meme bbvipks
kok waktu aku TKA engga ada,kok waktu aku tka tidak ada
maaf ya ga up progress belajar utbk.... Jujur aku ga ada energi buat belajar..... Udah abis pas ngejar TKA....,maaf ya tidak up progress belajar utbk jujur aku tidak ada energi buat belajar sudah habis pas ngejar tka
kok beres tka gaada to2 utbk lagi sih,kok beres tka tidak ada try out utbk lagi sih
ternyata gw se ngeluh itu ya sama tka,ternyata gue se ngeluh itu ya sama tka
"10/11/25📚‼️
D-2 belajar utbk setelah TKA!!
Hari ni aku disekolah ada PM LBE trus dirumah baca baca materi PU
#rjeskaBELAJAR",di belajar utbk setelah tka hari nih aku disekolah ada pm lbe terus dirumah baca baca materi punya rjeskabelajar
gara gara tka jadi ga mut mau utbk.,gara gara tka jadi tidak mut mau utbk
alay! mending lu belajar gih sono buat tka,alay mending kamu belajar gih sono buat tka
"Jujur aja, habis TKA tuh semangat belajar langsung drop BANGETT, apalagi pas di sekolah☺️☺️",jujur saja habis tka tuh semangat belajar langsung drop banget apalagi pas di sekolah
Gue cerita panjang di dm @L_MarshaJKT48 😭😭😭😭 mau gue apus nanti pgi kalo inget gue malu,gue cerita panjang di dm mau gue hapus nanti pagi kalau ingat gue malu
untung jaman gw SMA gaada TKA 😙😙😙,untung jaman gue sama tidak ada tka
"Zodiak kamu apa?
Pisces!
Oke nanti aku cari tau tentang zodiak pisces!",zodiak kamu apa pisces oke nanti aku cari tau tentang zodiak pisces
Tiba tiba harqeel anjrit 😭,tiba tiba harqeel anjrit
Sudah waktunya ganti tka jadi snbt,sudah waktunya ganti tka jadi snbt
"YESSSS AUTHOR UDH GA MABUK TKA, LOVE U BGT KAK ARCE MUACH MUACH",yes author sudah tidak mabuk tka love lu banget kak arce muach muach
guru guru setelah tka kayak ada dendam pribadi gitu langsung ngasih tugas setumpuk🙂,guru guru setelah tka kayak ada dendam pribadi begitu langsung mengasih tugas setumpuk
"- drama sunda
- presentasi geo (wawancara desa) 
- peta konsep 2 bab
- senam uprak 
- poster bio kel
- uprak senbud
- uh bio substansi genetik
- wawancara pkwu
- laporan pkwu
- hafalan pai
- ujian lisan pkn

gimana ngerjain tugas semua ini 🙂 habis tka terbitlah inieh",drama sunda presentasi geo wawancara desa peta konsep bab senam uprak poster bio keluarga uprak senbud uh bio substansi genetik wawancara pkwu laporan pkwu hafalan pai ujian lisan pkn bagaimana ngerjain tugas semua ini habis tka terbitlah inieh
Sekarang masih proses mengembalikan semangat belajar after TKA,sekarang masih proses mengembalikan semangat belajar after tka
siapa yang mau belajar tka bareng? 😓😓 pls yakinin kalo tka tuh gampang,siapa yang mau belajar tka bareng tolong yakinin kalau tka tuh gampang
Soal kalah gw menang soal tka gw telen tapo cintaku pdmu takakan eprnah sirna bosku,soal kalah gue menang soal tka gue telen tapi cintaku pdmu takakan eprnah sirna bosku
"ih oon deh, yang bocorin oon, yang jual oon, yang beli juga oon. di masa depan mau jadi apa coba kalau sekelas tka aja curang gini, semoga dapet balesan yang setimpal deh ya, semoga perut lu aman aman aja makan pake duit haram",ih oon deh yang bocorin oon yang jual oon yang beli juga oon di masa depan mau jadi apa coba kalau sekelas tka saja curang begini semoga dapat balesan yang setimpal deh ya semoga perut kamu aman aman saja makan pakai duit haram
"temen-temenn, mohon doa restunya untuk TKA besok, kebetulan aku gel 1 dan sesi 1. semoga aku diberi kemudahan dan kelancaran dalam mengerjakannya, segala doa kalian sangat berarti. semangat juga buat temen-temen yg lagi berjuang, semoga semuanya membuahkan hasil yg terbaik yaa 🫶🏻",tementemenn mohon doa restunya untuk tka besok kebetulan aku gel dan sesi semoga aku diberi kemudahan dan kelancaran dalam mengerjakannya segala doa kalian sangat berarti semangat juga buat tementemen yang lagi berjuang semoga semuanya membuahkan hasil yang terbaik ya
bodo amat pasrah tka meskipun bakalan malu karena nilainya jelek atau gmn jg BODO AMAT MONYENG YA ALLAH UDH CAPEK BGT,bodo amat pasrah tka meskipun bakalan malu karena nilainya jelek atau bagaimana juga bodo amat monyeng ya allah sudah capek banget
"⚠️ CALON MABA 2026 WAJIB TAU!
Ada aturan baru: lulus SNBP nggak bisa ikut SNBT/TKA 2026 😱

Biar nggak salah langkah, kamu perlu paham strateginya dari sekarang.
Kalau targetmu SNBT → persiapannya harus dimulai lebih awal!

BIC siap dampingi kamu biar peluang lolos makin besar",calon maba wajib tau ada aturan baru lulus snbp tidak bisa ikut snbttka biar tidak salah langkah kamu perlu paham strateginya dari sekarang kalau targetmu snbt persiapannya harus dimulai lebih awal bic siap dampingi kamu biar peluang lolos makin besar
"Bukankah Rapor Pendidikan sudah menjawab kebutuhan ini? Bahkan RP sdh jalan di hampir smua sekolah, sementara TKA opsional",bukankah rapor pendidikan sudah menjawab kebutuhan ini bahkan rp sudah jalan di hampir semua sekolah sementara tka opsional
"Trus dibandingin sama UN. Kayak kalian tu aja gak ngerjain soal tka, malah dibandingin sama UN. Kemarin aja aku belajar dari sumber UN, malah gampangan UN ya daripada TKA. Alhasil nyesel karna belajar dari sumber UN yg jelas jelas soalnya beda banget.",terus dibandingin sama un kayak kalian itu saja tidak ngerjain soal tka malah dibandingin sama un kemarin saja aku belajar dari sumber un malah gampangan un ya daripada tka alhasil menyesal karena belajar dari sumber un yang jelas jelas soalnya beda banget
"@txtdrimedia Bntar, coba cek kesesuaian antara materi pada kurikulum dengan soal yang diujikan di TKA. Jadi belum tentu berkaitan langsung fengan cara mengajar. Prediksi saya malah materi kurikulum krmana soal TKA kemana.",bentar coba cek kesesuaian antara materi pada kurikulum dengan soal yang diujikan di tka jadi belum tentu berkaitan langsung fengan cara mengajar prediksi saya malah materi kurikulum krmana soal tka kemana
belajar TKA start dari mana yaa?,belajar tka start dari mana ya
"knp semenjak selesai tka, semangat belajarku turun....",kenapa semenjak selesai tka semangat belajarku turun
jujur kl sampe nilai tka ekonomiku jelek pasrah aja,jujur kalau sampai nilai tka ekonomiku jelek pasrah saja
bener bener mau bikin zsh kedua mereka wkwk,benar benar mau bikin zsh kedua mereka wkwk
knp nm tka nya yoo kungmin,kenapa nama tka nya ya kungmin
literally gua pas ngerjain tka,literally gua pas ngerjain tka
"sebel banget liat generasi/angkatan di atas yang gampang meremehkan generasi kita cuma karena nilai TKA ga sesuai ekspektasi, terus dibanding-bandingin sama nilai UN. seolah-olah kondisinya sama, padahal jelas beda konteks dan beda sistem. UN setauku itu persiapan ada, soal jelas",sebel banget lihat generasiangkatan di atas yang gampang meremehkan generasi kita cuma karena nilai tka tidak sesuai ekspektasi terus dibandingbandingin sama nilai un seolaholah kondisinya sama padahal jelas beda konteks dan beda sistem un setauku itu persiapan ada soal jelas
kangen cinta belajar kayak persiapan tka itu 😞😞😞😞😞😞,kangen cinta belajar kayak persiapan tka itu
"Sch! Yang punya ch ada materi/ latihan soal gratis tka, UTBK, ujian mandiri, dll coba komen aku mau join",yang punya ch ada materi latihan soal gratis tka utbk ujian mandiri dll coba komen aku mau join
udah di tahap pasrah sm tka dan snbp,sudah di tahap pasrah sama tka dan snbp
"Pengalaman belajar TKA kepakai bgt buat belajar utbk. Aku jadi tau belajar itu harusnya fun &amp;  bisa nerima proses belajarnya. Belajar keras ga selalu efektif intinya. Karena kerasa pas TKA performaku turun, bahkan ak orek"" yg simple lama, ga kaya pas latsol.",pengalaman belajar tka kepakai banget buat belajar utbk aku jadi tau belajar itu harusnya fun   bisa menerima proses belajarnya belajar keras tidak selalu efektif intinya karena kerasa pas tka performaku turun bahkan aku orek yang simple lama tidak kaya pas latihan soal
"Karena yang diujikan kurikulum 2013, tapi yang diajarkan kurikulum merdeka (konteks TKA SD)

Kurikulum merdeka ketinggalan materi debit, volume dan banyak bab lain",karena yang diujikan kurikulum tapi yang diajarkan kurikulum merdeka konteks tka sd kurikulum merdeka ketinggalan materi debit volume dan banyak bab lain
imejin ini tka ulang dan gue lebih semangat belajar semalem… gue juga lebih tenang gt hari ini mau tka… how i LOVE second chances,imejin ini tka ulang dan gue lebih semangat belajar semalem gue juga lebih tenang begitu hari ini mau tka how i love second chances
"seriusan masa iya Monsta gaakan bahas elemental cahaya, kan itu dari villain besar si Rettaka. Solar juga jarang dikeluarin, mereka apa gamau ngevaluasi kekuatan si Solar?? harusnya sih diteliti ya karna dengan kuasa Gamma si Rettaka bisa ngalahin sepuh sepuh lain—",seriusan masa iya monsta gaakan bahas elemental cahaya kan itu dari villain besar sih rettaka solar juga jarang dikeluarin mereka apa tidak mau ngevaluasi kekuatan sih solar harusnya sih diteliti ya karena dengan kuasa gamma sih rettaka bisa mengalahkan sepuh sepuh lain
jadii kangen pas tka gini,jadi kangen pas tka begini
"Gara"" TKA soal asas ada multiple choice nya anjir 😭😭😭",gara tka soal asas ada multiple choice nya anjir
mkny yh kt gw... Klo mw bikin kebijakan tu dipikirin dlu yg bener... Mentang mentang wowo bikin mbg langsung bergerak eh elu juga ikut ikut langsung jebretin tka... Like wdyd.....,mkny ya kita gue kalau mau bikin kebijakan itu dipikirkan dulu yang benar mentang mentang wowo bikin mbak langsung bergerak eh lu juga ikut ikut langsung jebretin tka like wdyd
"update, sampe sekarang belom gue kerjain ini soal TKA",update sampai sekarang belum gue kerjain ini soal tka
"WEH IYA, riki katanya mau oreo hair yaa klo enha dpet daesang?? im waiting 👀",weh iya riki katanya mau oreo hair ya kalau enha dpet daesang im waiting
@tkafess 15 tahun gue sekolah dan pemahaman kemampuan gue hanya divalidasi 2 hari. ditambah banyak kecurangan yang TOLOL nya banyak ngerjain TKA pakai AI. dan ANJINGNYA TKA digunakan sebagai landasan SNBP. Sarjana indonesia 4 tahun lagi adalah SARJANA TOLOL.,tahun gue sekolah dan pemahaman kemampuan gue hanya divalidasi hari ditambah banyak kecurangan yang tolol nya banyak ngerjain tka pakai ai dan anjingnya tka digunakan sebagai landasan snbp sarjana indonesia tahun lagi adalah sarjana tolol
"Klu terkait bandara aku sih ga yakin klu ILEGAL krn bandara pembangunan dan operasinya tdk semudah terminal angkutan darat. Klu mngkin terkait TKA yg hadir tdk sesuai ketentuan pastilah banyak, krn di Kalbar ada TKA jd tukang pikul pipa, tukang galon (pasti bukan tukang ahli)",kalau terkait bandara aku sih tidak yakin kalau ilegal karena bandara pembangunan dan operasinya tidak semudah terminal angkutan darat kalau mungkin terkait tka yang hadir tidak sesuai ketentuan pastilah banyak karena di kalbar ada tka jadi tukang pikul pipa tukang galon pasti bukan tukang ahli
"waktu baca soal cerita panjang di tka kemarin, rasanya capek bgt. tapi keinget, biasanya sehari bisa libas 100+ halaman novel yg tebel-tebel. masa gini aja udah capek

smg bulan ini aku bisa jadi rajin baca lagi

lagian ini bakal berpengaruh baik kalau nanti snbt juga ga sih? 😋",waktu baca soal cerita panjang di tka kemarin rasanya capek banget tapi teringat biasanya sehari bisa libas halaman novel yang tebeltebel masa begini saja sudah capek semoga bulan ini aku bisa jadi rajin baca lagi lagian ini bakal berpengaruh baik kalau nanti snbt juga tidak sih
"Cinta tak kenal waktu, menjagamu 🤍",cinta tak kenal waktu menjagamu
sp stuju tka inggris lebih gampang dari tka indo☝️ (aku),sapa setuju tka inggris lebih gampang dari tka indonesia aku
"temen-temen 26, review TKA nya dong, kalau bisa sampai suasana ruangannya kayaa gimana kemarin wkskskns",tementemen review tka nya dong kalau bisa sampai suasana ruangannya kaya bagaimana kemarin wkskskns
ehh UNPAD pake perhitungan TKA gaa yaah? 😞,eh unpad pakai perhitungan tka tidak ya
Tak dapat bbg 😭😭😭😭 tka dapat woozi punya jugak 😭😭😭😭😭😭😭,tak dapat bbg tka dapat woozi punya juga
"Awal Nov TKA, awal Des PAS... Stress dikit 😫",awal nov tka awal des pas stres dikit
kalian ga tau aku se merinding apa waktu denger nama enhypen,kalian tidak tau aku se merinding apa waktu dengar nama enhypen
Dih tka bw hp? Gw kira kek snbt jir,dih tka bawa hp gue kira kayak snbt jir
"life after tka : tugas banyak, uas di depan mata, belajar lagi buat utbk 😇",life after tka tugas banyak uas di depan mata belajar lagi buat utbk
Tidak salah memang beliau the great legendary,tidak salah memang beliau the great legendary
"Masuk sekolah negri skrg tu ga gampang buat yg nilainya pas2an, rumahnya jauh, ato ga ada prestasi apa2. Ini ada harapan di TKA, eh malah santai aja ga ada usaha. Ga nonton TV seminggu mah ga akan bikin stress atuh",masuk sekolah negeri sekarang itu tidak gampang buat yang nilainya pasan rumahnya jauh atau tidak ada prestasi apa ini ada harapan di tka eh malah santai saja tidak ada usaha tidak menonton tv seminggu mah tidak akan bikin stres atuh
Udah ketebak kalau hasil TKA bakalan jelek dan udah paham siapa pihak pertama yang bakal disalahin.,sudah ketebak kalau hasil tka bakalan jelek dan sudah paham siapa pihak pertama yang bakal disalahin
"Besok udah UAS, mau belajar tapi udah kek kehilangan minat dari  setelah selesai TKA 🫠🫠",besok sudah uas mau belajar tapi sudah kayak kehilangan minat dari setelah selesai tka
"Nilai rata rata disekolah gua ga memadai terus gurunya bilang ""kalian kurang berusaha selama TKA ini"" SYAP SALAH PAK/BU",nilai rata rata disekolah gua tidak memadai terus gurunya bilang kalian kurang berusaha selama tka ini syap salah pakbu
ca qejfit me hanger hamburger kur tka marr uria 😋,ca qejfit me hanger hamburger kur tka marr uria
"TKA ku hari ini lancar, lebih baik dari TKA sebelumnya.
Tanggal 5 Januari dapet sertifikat TKA dengan kategori istimewa",tka ku hari ini lancar lebih baik dari tka sebelumnya tanggal januari dapat sertifikat tka dengan kategori istimewa
SOAL TKA KALAH SAMA INI 😭,soal tka kalah sama ini
Iya soalnya lowongan dalem negeri untuk TKA,iya soalnya lowongan dalem negeri untuk tka
"ya allah cape bgttt, hari ini konser ke 100 dremies ya? 🥹🥹🥹🥹. semenjak sibuk TKA jadi kurang update pls ya allah kangen bgt",ya allah capek banget hari ini konser ke dremies ya semenjak sibuk tka jadi kurang update tolong ya allah kangen banget
"""STOP MAKSAIN DIRI KALIAN... DI UMUR SEGITU KALIAN HARUS NYA BELAJAR TKA BUKAN NYELAMATIN GALAKSI 😭😭""",stop memaksakan diri kalian di umur segitu kalian harus nya belajar tka bukan nyelamatin galaksi
kakaknya adalah aku klo pas aku lg nugas sendirian di cafe trs liat anak sma lg pd nongkrong abis pulsek or nugas/belajar bareng buat utbk/tka 😔😔,kakaknya adalah aku kalau pas aku lagi nugas sendirian di cafe terus lihat anak sama lagi pada nongkrong habis pulsek atau nugasbelajar bareng buat utbktka
Bangga banget sama lu @L_MarshaJKT48,bangga banget sama kamu
"efek samping jarang baca buku selama 4 bulanan : RASANYA OTAK NGELAG PARAH💔💔💔
lama bgt gk ngetwit huhu.. soalnya aku berbulan-bulan nggak megang bukuu, gatau mau bahas apaan😭

Terakhir ngehype buku kapan ya, udah lama bangett, btw bbrp minggu lalu aku abis gelut sama tka💔💔",efek samping jarang baca buku selama bulanan rasanya otak ngelag parah lama banget tidak ngetwit huhu soalnya aku berbulanbulan tidak memegang bukuu tidak tau mau bahas apaan terakhir ngehype buku kapan ya sudah lama banget btw beberapa minggu lalu aku habis gelut sama tka
"@cruelladevjl Nama: Ella

Jenis Kelamin: Cewek

Usia: 17-18 (keliatan lagi SMA, prepare SNBP/TKA)

Pencapaian: Ambisius belajar, handle sendiri, punya girlies supportif

Hobi: Nongkrong, belajar (walau bete), chat sm temen

Pekerjaan: Pelajar SMA

Masa depan: Masuk univ top, mungkin jurusan",nama ella jenis kelamin cewek usia kelihatan lagi sama prepare snbptka pencapaian ambisius belajar handle sendiri punya girlies supportif hobi nongkrong belajar walau bete chat sama teman pekerjaan pelajar sama masa depan masuk universitas top mungkin jurusan
gua literally blm mulai belajar utbk lagi after TKA 😭,gua literally belum mulai belajar utbk lagi after tka
"mentimun minta doa nya yah, agit abis dibantai tka mau dibantai uas besok 😩😩",mentimun meminta doa nya ya kelas tiga habis dibantai tka mau dibantai uas besok
Cuk satu hotel sama PK LPDP “PK juga ya mbak?” 😭😭😭,cuk satu hotel sama pakai lpdp pakai juga ya mbak
"ga bangsat anjing elektrolisis gw ketinggalan banyak gobs waktu itu gw gapeduli materinya karena ga ambil tka kimia and belajar modal 5 jam semua materi semester 5, IM COOKED, wish me luck 😭😭💔💔",tidak bangsat anjing elektrolisis gue ketinggalan banyak gobs waktu itu gue gapeduli materinya karena tidak ambil tka kimia and belajar modal jam semua materi semester im cooked wish me luck
"sch! bantu aku ngebagi waktu buat tugas rangkuman dan tugas lain, nyiapin ujian yang sisa satu minggu lagi, nyiapin buat tka.. tolonh ini udah burnout banget😭",bantu aku ngebagi waktu buat tugas rangkuman dan tugas lain nyiapin ujian yang sisa satu minggu lagi nyiapin buat tka tolonh ini sudah burnout banget
"kasian banget woi, di Arc Baraju dia ga ada istirahatnya..
pecah dua, hilang ingatan, jadi sopan, baru balik ditangkep si Bahlil, abis itu fusion, pecah dua tahap 3.. damn..",kasihan banget woi di arc baraju dia tidak ada istirahatnya pecah dua hilang ingatan jadi sopan baru balik ditangkep sih bahlil habis itu fusion pecah dua tahap damn
gajelas banget sekolahku. masa besok ada tka susulan tp ga diumumkan bakal tetap ada kelas atau enggak sampai hampir jam 10 malam ini?! hobi bngt gantung,tidak jelas banget sekolahku masa besok ada tka susulan tapi tidak diumumkan bakal tetap ada kelas atau enggak sampai hampir jam malam ini hobi banget gantung
KANNNNNN! UDAH BENER GAK USAH ADA TKA SEGALA,kan sudah benar tidak usah ada tka segala
"review nilai tka mapel wajib

1. bahasa indonesia: nilainya jelek si, tapi masih di atas ekspektasi aku. karena aku berpikir aku ngga akan dapat predikat istimewa karena dua soal ngga aku jawab
2. matematika: emang tai, nilai paling jelek 🖕🏻🖕🏻🖕🏻🖕🏻🖕🏻🖕🏻🖕🏻🖕🏻🖕🏻🖕🏻",review nilai tka mata pelajaran wajib bahasa indonesia nilainya jelek sih tapi masih di atas ekspektasi aku karena aku berpikir aku tidak akan dapat predikat istimewa karena dua soal tidak aku jawab matematika memang tahi nilai paling jelek
"Things I've experienced (and soon, probably) as angkatan 2026 student
1. UN dihapus, daring dari kelas 6 krn covid
2. Kurikulum 2013
3. Ganti kurikulum merdeka
4. TKA
5. DPR ga setuju TKA sbg validator
6. UTBK SNBT dimajuin
7. Gaboleh ad study campus, perpisahan, yb
8. Ts shit",things ive eerienced and soon probably as angkatan student un dihapus daring dari kelas karena covid kurikulum ganti kurikulum merdeka tka dpr tidak setuju tka sebagai validator utbk snbt dimajuin gaboleh ada study campus perpisahan yb ts shit
"bad bgt day2 tka, dr pagi udh pusing bgt kepala, kurang ngulang mapel pilihan (karna malemnya ketiduran) syokk bgt liat soal² nya, walaupun ada bbrp yg bisa ditebak, d pertengahan soal kepala tiba-tiba pusinggg bgt (untung ga pingsan 😇 pas eko no 25 gabisa d pencet, udh panik..",bad banget day tka dari pagi sudah pusing banget kepala kurang ngulang mata pelajaran pilihan karena malemnya ketiduran syokk banget lihat soal nya walaupun ada beberapa yang bisa ditebak di pertengahan soal kepala tibatiba pusing banget untung tidak pingsan pas eko no tidak bisa di pencet sudah panik
tka pls cepet beres aku mau belajar utbk dengan tenang,tka tolong cepat beres aku mau belajar utbk dengan tenang
assalamu'alaikum TKA ☺,assalamualaikum tka
"Ehhhh mauuu donggg liat soal TKA nyaaa, penasaran bgtt aku tuhhh😭😭",eh mau dong lihat soal tka nya penasaran banget aku tuh
"@utbkcak Udah pernah liat soal matematika SD kelas 1, 2, dan 3 jauh dari kata sederhana. Jadi soal matematika untuk TKA udah kyk mana ya yang dibilang ""sederhana"".",sudah pernah lihat soal matematika sd kelas dan jauh dari kata sederhana jadi soal matematika untuk tka sudah kayak mana ya yang dibilang sederhana
abis beresin TO TKA pahamify tanpa belajar (gabut soalnya mau ngapain) alhasil hasilnya kaya apaan tau 😊😊💔💔😀😀,habis beresin try out tka pahamify tanpa belajar gabut soalnya mau mengapai alhasil hasilnya kaya apaan tau
"Unas dulu yg ga kepake buat masuk kuliah aja anak2 pada takut ga lulus hingga mau ga mau harus belajar giat dan di drill latihan soal2 tiap hari sampe sore sejak kelas 3 semester 2.
Atau memang sesusah banget itukah soal TKA nya hingga banyak yg ga expect soal2 yg keluar?",unas dulu yang tidak kepake buat masuk kuliah saja anak pada takut tidak lulus hingga mau tidak mau harus belajar giat dan di drill latihan soal tiap hari sampai sore sejak kelas semester atau memang sesusah banget itukah soal tka nya hingga banyak yang tidak eect soal yang keluar
"Ini mutualku yg seumuran smpe skrng gapernah keliatan aku rasa dia udh prepare utbk+tka, semangatin aku semuanyaaaa aku smpe skrng ovt sama masa depanku ini kira2 bisa kuliah apa engga ya ☹️",ini mutualku yang seumuran sampai sekarang tidak pernah kelihatan aku rasa dia sudah prepare utbktka semangatin aku semuanya aku sampai sekarang ovt sama masa depanku ini kira bisa kuliah apa tidak ya
Ide soal TKA matematika,ide soal tka matematika
"@sedangdipagar @RyandanaGa8729 @tempodotco Kalo liat soalnya udah nyaris SNBT. Harusnya TKA lebih pd review materi. Minim persiapan, kisi-kisi soal tidak sama dgn TKA, Hasilnya jeblok sudah pasti. Juara olimpiade Math aja ngak bs jawab semua soal, apalagi yg bukan..",kalau lihat soalnya sudah nyaris snbt harusnya tka lebih pada review materi minim persiapan kisikisi soal tidak sama dengan tka hasilnya jeblok sudah pasti juara olimpiade math saja tidak bisa jawab semua soal apalagi yang bukan
"gua ga ngarep samsek dah sama tka yg gua pelajari di luar soal tka semua anj, klo tau soalnya cuma itu itu aja ga bljr semua yg di perkaban anjir sia sia nilai rapot gua",gua tidak mengharap samsek sudah sama tka yang gua pelajari di luar soal tka semua anjing kalau tau soalnya cuma itu itu saja tidak belajar semua yang di perkaban anjir sia sia nilai rapot gua
"Niat buka twitter nyari bahan lucu karena abis belajar TKA, malah dibuat sakit jiwa ama drama anitwt",niat buka twitter mencari bahan lucu karena habis belajar tka malah dibuat sakit jiwa sama drama anitwt
"Gamau punya tiktok, karna di tiktok anak seumuran aku udah banyak yang nikah bjiL, aku aja masih pusing mempersiapkan tka",tidak mau punya tiktok karena di tiktok anak seumuran aku sudah banyak yang nikah bjil aku saja masih pusing mempersiapkan tka
"ptn! aku mau mulai belajar snbt dan tka. apa yang harus aku lakuin dulu ya? aku bingung, kebetulan aku belum nyusun belajar snbt dulu apa tka. tolong sarannya, thank you! &lt;3",aku mau mulai belajar snbt dan tka apa yang harus aku melakukan dulu ya aku bingung kebetulan aku belum nyusun belajar snbt dulu apa tka tolong sarannya thank you lantai
"bisa gak sih sebelum lamar jd calon presiden, anggota dpr, pejabat2 gitu ada tes tka nya dulu? ini kok kayak pd gak ada ya common sensenya",bisa tidak sih sebelum lamar jadi calon presiden anggota dpr pejabat begitu ada tes tka nya dulu ini kok kayak pada tidak ada ya common sensenya
Kangen belajar TKA ga sih....belajarnya doang,kangen belajar tka tidak sihbelajarnya doang
"sch! rata-rata 94, eli 1, sertif inter (bidang stem) sama sertif nasional (harapan 1 esai ugm), tka ambil biokim, mending cb ke mana yaaa? dom sumut tp, sklh akred a tp blm ad alumni yg ke ptn krn pada ke ptln wkwk",ratarata eli sertif inter bidang stem sama sertif nasional harapan esai ugm tka ambil biokim mending coba ke mana ya dom sumut tapi sekolah akred a tapi belum ada alumni yang ke ptn karena pada ke ptln wkwk
jujur gak mau liat sertifikat tka,jujur tidak mau lihat sertifikat tka
"AAAA SAYANG SAYANG AKUUU SELAMATTT!!!!!🎉😭💐🫶 aku seneng banget bisa jadi bagian dari moa dan berusaha voting walau ketubruk tubruk sama tka dan kesibukan agit lainnya tapi ini terbayar, dan sekali lagi SELAMATT MY BOYS, YOU DESERVED IT🫶🫶",a sayang sayang aku selamat aku senang banget bisa jadi bagian dari moa dan berusaha voting walau ketubruk tubruk sama tka dan kesibukan kelas tiga lainnya tapi ini terbayar dan sekali lagi selamatt my boys you deserved itu
dua tahun masih berpikiran yang sama,dua tahun masih berpikiran yang sama
"Kocakk, bismillah 2027 gak dapet TKA",kocakk bismillah tidak dapat tka
