full_text,normalized
YA ALLAH CAPEKBGTT BELAJAR TKA,ya allah capek banget belajar tka
"hiii tmntmn ada yang punya server discord buat discuss, belajar utbk tka gitu nggak yaaa? kalau ada yang punya bagiii yaaa, terima kasiiih",hi teman teman ada yang punya server discord buat diskusi belajar utbk tka begitu tidak ya kalau ada yang punya bagi ya terima kasih
"Ini kalo file s word gue ilang, gue ngamuk sih (laptop dipake adek buat belajar tka)",ini kalau file si word gue hilang gue ngamuk sih laptop dipakai adek buat belajar tka
"kalian bljr TKA nya langsung latsol, apa dari materi kelas 10-11? AKU BINGGUNG BGT",kalian belajar tka nya langsung latihan soal apa dari materi kelas aku binggung banget
Sekolah macam apa yg sampe hari ini belum share pembagian jadwal tka? Sekolah gue ☝🏻☝🏻☝🏻,sekolah macam apa yang sampai hari ini belum share pembagian jadwal tka sekolah gue
"bentar ya cowo kpopku, tungguin aku kelar tka aku bakal hype kalian lagi 😭",bentar ya cowok kpopku tungguin aku kelar tka aku bakal hype kalian lagi
"Ya Allah h-2 tka malah flu, gegara seminggu kemarin kehujanan+pulang malem😩 kira² di lab nanti boleh bawa tisu gak ya :((",ya allah h tka malah flu gegara seminggu kemarin kehujananpulang malam kira di lab nanti boleh bawa tisu tidak ya
"paling keinget di beberapa sesi keluar soal yang solvingnya harus pake modulo, while 80% sekolahan ga ngajarin materi modulo. aku sendiri dapet materi mod dari olim infor, why do why tiba tiba keluar di tka mtk. emang ga sesusah itu tapi kalo ga tau basicnya ya ga bisa ngerjain",paling teringat di beberapa sesi keluar soal yang solvingnya harus pakai modulo while sekolahan tidak mengajari materi modulo aku sendiri dapat materi mod dari olim infor kenapa di kenapa tiba tiba keluar di tka matematika memang tidak sesusah itu tapi kalau tidak tau basicnya ya tidak bisa ngerjain
"hm starter pack pas tka apaan ya kata nyokap bawa diri ae kl buku atau catetan kecil nnti dikira nyontek, serba salah",hm starter pack pas tka apaan ya kata nyokap bawa diri aja kalau buku atau catetan kecil nanti dikira nyontek serba salah
"@arsorionn @maroshiv Yash, karena di TKA soal soalnya tergolong sulit dipahami, tidak familiar bahkan guru² di sekolah tertentu tidak mengajarkan, kualitas guru Indonesia juga harus dibetulkan bukan hanya siswanya saja yang disalahkan, mereka kadang ngajar materi SMA kaya TK",yash karena di tka soal soalnya tergolong sulit dipahami tidak familiar bahkan guru di sekolah tertentu tidak mengajarkan kualitas guru indonesia juga harus dibetulkan bukan hanya siswanya saja yang disalahkan mereka kadang mengajar materi sama kaya tak
"agak kecewa sama hasil tka😣
kita balas di snbt🤓",agak kecewa sama hasil tka kita balas di snbt
udah h-3 tka masih belum ngerti kimia banget,sudah h tka masih belum mengerti kimia banget
"ga minta banyak tahun depan
1. iPhone 15 warna pink
2. masuk SMA yang dipengin
3. dapet nilai tka bagus-bagus
4. rumah makin bagus
5. JADII KAYAAAA DI TAHUN 2026",tidak meminta banyak tahun depan iphone warna pink masuk sama yang dipengin dapat nilai tka bagus bagus rumah makin bagus jadi kaya di tahun
kalian belajar tka mtk di ch yt mana gais??,kalian belajar tka matematika di ch yt mana guys
"guys masa guru gue bilang buat yang gelombang 1 TKA jgn pelit pelit sama gelombang 2, intinya tuh kita disuruh bocorin soalnya, dan beliau jg bilang buat bawa contekan kecil trus disuruh buat nyelipin buat dibawa masuk😧😧",guys masa guru gue bilang buat yang gelombang tka jangan pelit pelit sama gelombang intinya tuh kita disuruh bocorin soalnya dan beliau juga bilang buat bawa contekan kecil terus disuruh buat nyelipin buat dibawa masuk
"wah hari ini eps 3 tayang, itu tandanya ajalku sdh di depan mata (bertemu tka) 🤗♥️",wah hari ini episode tayang itu tandanya ajalku sudah di depan mata bertemu tka
TKA beberapa hari lagi dan aku blom ngerti sm mtk,tka beberapa hari lagi dan aku belum mengerti sama matematika
tka tka tka tka tka tka hadehh,tka tka tka tka tka tka hadehh
what if gua kabur hari pertama tka,apa if gua kabur hari pertama tka
mikirin tka bkn nangis mikirin soal nangis mikirin gmn gw nnti kuliah dewasa kerja nikah 😭😭😭😭😭💔💔💔,memikirkan tka bukan menangis memikirkan soal menangis memikirkan bagaimana gue nanti kuliah dewasa kerja nikah
"Wait aku gatau temen2ku dan aku sendiri yang memang basic inggrisnya bagus entah kenapa TKA engnya jelek, sebetulnya ini questionable things sih kenapa hasilnya bisa begitu",tunggu aku tidak tau temenku dan aku sendiri yang memang basic inggrisnya bagus entah kenapa tka inggrisnya jelek sebetulnya ini questionable things sih kenapa hasilnya bisa begitu
"sampai sekarang ak masih bingung jurusan ak...dan untuk tka dari sekolah gabisa linjur, so ada saran ga buat mapel peminatan mtk l, fisika, b. Jepang. SEBENARNYA GAMAU BGT FISIKA tapi kalau ngambil teknik.....",sampai sekarang aku masih bingung jurusan akdan untuk tka dari sekolah tidak bisa lintas jurusan sok ada saran tidak buat mata pelajaran peminatan matematika l fisika b jepang sebenarnya tidak mau banget fisika tapi kalau ngambil teknik
"ah elah sibuk tka, tpi gpp aku sempetin buat main",ah elah sibuk tka tapi tidak apa-apa aku sempetin buat main
"kegiatan yang pengen dilakuin abis TKA :
1. main roblox dr pagi sampe malem",kegiatan yang pengin dilakuin habis tka main roblox dari pagi sampai malam
"@Aidachoirunnisa @maroshiv Bhs inggris TKA itu tergolong susah karena setiap anak mendapatkan soal berbeda ada yg dari 25 soal, 13 soalnya multichoice salah 1 tidak ada skornya.",bahasa inggris tka itu tergolong susah karena setiap anak mendapatkan soal berbeda ada yang dari soal soalnya multichoice salah tidak ada skornya
"gusy jumlah soal tka tuh udah di kasi tau blm si? dan untuk skor tka bsk, kira² orang lain bisa lihat skor kita ga? 😔😔😔",guys jumlah soal tka tuh sudah di kasih tau belum sih dan untuk skor tka besok kira orang lain bisa lihat skor kita tidak
"selamat pagi semuanya, gua mau soft spoken hari ini bcs h-2 TKA (sedang memperbaiki kondisi psikis)",selamat pagi semuanya gua mau soft spoken hari ini karena h tka sedang memperbaiki kondisi psikis
eh yaallah thread jalur langit tka itu kemana guys,eh yaallah thread jalur langit tka itu kemana guys
"tka tka tka, a nya astaghfirullah, k nya kuatkan kami yaallah, t nya apa guys 😮‍💨",tka tka tka a nya astaghfirullah ke nya kuatkan kami yaallah t nya apa guys
Mau nanya dong untuk kakak² sch! cantik &amp; ganteng. Materi utbk itu susah gak? Dan apakah ada saran baiknya lebih fokus ke tka atau utbk untuk anak kelas 12?,mau bertanya dong untuk kakak cantik   ganteng materi utbk itu susah tidak dan apakah ada saran baiknya lebih fokus ke tka atau utbk untuk anak kelas
TKA lu bener bener menyusahkan semua org ya puki🥰🙏🏻🙏🏻,tka kamu benar benar menyusahkan semua orang ya puki
SIAPASIH TKA TKA IT….. IHATETKA!!!,siapasih tka tka itu ihatetka
eh kok gw aga nyesel beli buku un/us kmrn kenapa ga beli yg tka lgsg yaa???? isinya sama gasi guiiisss pwiss dua enam pipol wajib rep,eh kok gue aga menyesal beli buku unus kemarin kenapa tidak beli yang tka langsung ya isinya sama gasi guis pwiss dua enam pipol wajib komen
tka 2026 ni konsepnya gimana si guys? yg akt 26 rep dong mw tau wkwkwkw,tka nih konsepnya bagaimana sih guys yang angkatan komen dong mau tau wkwkwkw
wow jumat ada to tka di sekolah,wow jumat ada try out tka di sekolah
SNBT tahun 2026 tuh nanti ada TKA kayak tahun 2022 atau TPS semua kayak tahun ini?,snbt tahun tuh nanti ada tka kayak tahun atau tps semua kayak tahun ini
bisa ga ya TKA ini susulan aja tapi taun pas bulan februari aja muak tau ga sih,bisa tidak ya tka ini susulan saja tapi tahun pas bulan februari saja muak tau tidak sih
"ptn! Untuk yang pernah ikut utbkplus unair/mandiri reguler unair, ada kah yang bersedia aku dm, mau tanya-tanya soal TKA dan penilaiannya (uner dikit bgt infonya...)",untuk yang pernah ikut utbkplus unairmandiri reguler unair ada kah yang bersedia aku dm mau tanyatanya soal tka dan penilaiannya uner dikit banget infonya
"MENDING RUANG GURU ATAU PAHAMIFY???? ATAU APA.....
(include tka, snbt, materi kls 10-12)",mending ruang guru atau pahamify atau apa include tka snbt materi kelas
akt 26 itu jadinya SMA apa TKA?,angkatan itu jadinya sama apa tka
"Ptn! Guys, skor utbk aku 621. Mau ikut utul ugm pil 1 fk, pil 2 bio. Kira kira bundir ga ya? Sama TKA buat bio mapel apa aja?",guys skor utbk aku mau ikut utul ugm pil fk pil bio kira kira bundir tidak ya sama tka buat bio mata pelajaran apa saja
“selsai kalian uas nanti langsung to tka” ingin bernafas,selsai kalian uas nanti langsung try out tka ingin bernafas
"teman-teman mau nanya, beli buku tka itu nanti sesuai prodi yang kita pilih kan? misal aku ambil hukum, berarti versi IPS kan yang aku belii",temanteman mau bertanya beli buku tka itu nanti sesuai prodi yang kita pilih kan misal aku ambil hukum berarti versi ips kan yang aku belii
"Gaiss, ada yg punya list materi buat TKA yang wajib nggakk?? Yang matematika sama bahasa indo+inggris??",gaiss ada yang punya list materi buat tka yang wajib nggakk yang matematika sama bahasa indoinggris
dikirim pap mata sayu sm berondong tuh artinya apa 😭😭😭😭 yaampun dek dek mending km belajar tka soalny aku juga sainganmu tahun depan,dikirim pap mata sayu sama berondong tuh artinya apa yaampun dek dek mending kamu belajar tka soalny aku juga sainganmu tahun depan
Buten! udah ada yg dpt file soal to tka kmrn ga ya?... sender mau review:(,sudah ada yang dapat file soal try out tka kemarin tidak ya aku mau review
gais TKA tuh khusus snbp aja ya? brti untuk utbk tetep sama kayak tahun ini?,guys tka tuh khusus snbp saja ya brti untuk utbk tetap sama kayak tahun ini
Stud! Ada tips buat belajar cepet paham di beberapa materi TKA fisika ga ya? Udah hopeless bgt... emg susah bgt ya?,ada tips buat belajar cepat paham di beberapa materi tka fisika tidak ya sudah hopeless banget memang susah banget ya
"to do liburan kenaikan kls akt 26 = 
1. Belajar TKA (wajib)
2. Belajar UTBK (wajib)
3. Ibadah (wajib)
4. Tidur (opsional)",try out di liburan kenaikan kelas angkatan belajar tka wajib belajar utbk wajib ibadah wajib tidur opsional
TKA ada listening ga yaa,tka ada listening tidak ya
"hmmmmm masih mempertimbangkan beli buku tka ap ngga, i mean ak masih gtw modelan soalnya sih, tp ya ak mau review materi dl esp biokimia,,,, hmmmmm beli g y buku te ka a hmmmmm ap nunggu wangsit muncul yy",hm masih mempertimbangkan beli buku tka apa tidak i mean aku masih tidak tau modelan soalnya sih tapi ya aku mau review materi dulu esp biokimia hm beli tidak ya buku te kak a hm apa menunggu wangsit muncul yy
eh aku kapan ya mulai nyicil belajar tka…………,eh aku kapan ya mulai mencicil belajar tka
Masih ga ngerti gua TKA TKA taun depan? Berarti subtes utbk diganti TKA gitu?,masih tidak mengerti gua tka tka tahun depan berarti subtes utbk diganti tka begitu
"ngedip bentar osn h-17
ini gua blm nyentuh tka samsek.........
hari selasa baru psat",ngedip bentar osn h ini gua belum nyentuh tka samsek hari selasa baru psat
"ya Allah jauhkan hamba dari rasa malas, tka su dekat ya Allah",ya allah jauhkan hamba dari rasa malas tka su dekat ya allah
Yang anak inten udh pada bahas tka blm,yang anak inten sudah pada bahas tka belum
Ini TKA klo jadi manusia udah gw kirim ke barak,ini tka kalau jadi manusia sudah gue kirim ke barak
fomo bgt liat 26 yang lain jd satu ada groupiesnya gt pls angkut mau ikut membantai tka bersama sama 🐌☮️🧛🏿‍♀️💓🙈💃🏻,fomo banget lihat yang lain jadi satu ada groupiesnya begitu tolong angkut mau ikut membantai tka bersama sama
Eh wwwww semangat TKA nya 26 ☝️☝️ (adikku 26),eh semangat tka nya adikku
pgn ngerjain 13 bab Bhs inggris di buku tka,pengin ngerjain bab bahasa inggris di buku tka
"jadi gimana guys, kalian fokus utbk atau tka dulu nii?",jadi bagaimana guys kalian fokus utbk atau tka dulu ini
"temaan teman, ada saran atau ada yang open private untuk TKA mapel Fisika ngga yaa, terima kasih banyak&lt;3",temaan teman ada saran atau ada yang open private untuk tka mata pelajaran fisika tidak ya terima kasih banyaklt
"lu pada yg akt 26 klo bingung blajar tka, makek ini coba bisa ni ngebantu klen",kamu pada yang angkatan kalau bingung belajar tka makek ini coba bisa nih membantu kalian
"dahlah nanti juga masuk undangan pil 1
dan tka nembus 100+++ #pede",dahlah nanti juga masuk undangan pil dan tka nembus percaya diri
"Hi izin qrt ya! Cb pake rg, yg rubelnya aj udh incl vids pembelajaran, rangkuman, latsol, bank soal+drill soal yg up2date bgt~ materi dia jg lengkap sub2nya. Referensi soal2nya jg relevan bs prsiapan tka+utbk. Cus kl mw tnya2/beli dm ajaaa ak jg jual sharingnya jd lbh murce😍",hi izin qrt ya coba pakai rg yang rubelnya saja sudah incl vids pembelajaran rangkuman latihan soal bank soaldrill soal yang update banget materi dia juga lengkap subnya referensi soalnya juga relevan bisa prsiapan tkautbk cus kalau mau tnyabeli dm saja aku juga jual sharingnya jadi lebih murce
boleh buat peraturan ga boleh sebut tka 5 kali seminggu aja,boleh buat peraturan tidak boleh sebut tka kali seminggu saja
ada yang minat buat belajar tka english gak ? Aku open class bagi yang mau ☺️,ada yang minat buat belajar tka english tidak aku open class bagi yang mau
"Ptn! mau nanya buat sm unair yang mandiri reguler tahun lalu tpa tka nya berapa soal dan berapa jam yaa, sama apakah kakak yang udh lolos smua ada rekomendasi bim bel on line?",mau bertanya buat sama unair yang mandiri reguler tahun lalu tpa tka nya berapa soal dan berapa jam ya sama apakah kakak yang sudah lolos semua ada rekomendasi bim bel on line
"Bermodalkan sisa langganan mipy, studytwt dan grup 26 ku yang bejibun itu, ak udah siap membantai tka dan utbk #Allahbersamaangkatan26 (tapi baru mulai pas udah nyampe rumah)",bermodalkan sisa langganan mipy studytwt dan grup ku yang bejibun itu aku sudah siap membantai tka dan utbk allahbersamaangkatan tapi baru mulai pas sudah sampai rumah
ADUHHH dari sekian banyaknya TKA KNP GUA PILIHA FISIKA MTK MINAT DAN KIMIA 🤬🤬🤬,aduh dari sekian banyaknya tka kenapa gua piliha fisika matematika minat dan kimia
Akulah PP 4 jam itu. Alias info loker plis,akulah pp jam itu alias info loker tolong
pengen punya pacar terus ntar kita study date buat prepare tka bersama 🤓🤓🤓🤓🤓,pengin punya pacar terus entar kita study date buat prepare tka bersama
apa ya kayak mau belajar tka tapi akunya bingung liat materi nya jdi switch ke bahasa🙂,apa ya kayak mau belajar tka tapi akunya bingung lihat materi nya jadi switch ke bahasa
"planning libur smt dah numpuk yah... belajar tka + utbk gaada tidur tiduran marathon drakor, sekarang marathon materi tka 🥹",planning libur smt sudah numpuk ya belajar tka utbk tidak ada tidur tiduran marathon drakor sekarang marathon materi tka
"Kocakk, buku tka ku baru dikirim",kocakk buku tka ku baru dikirim
"mending langsung belajar buat utbk, atau belajar buat tka dulu???. bingung bangettt, atau harus belajar buat dua duanya??, tapi nilai raportku juga pas pasan sih.",mending langsung belajar buat utbk atau belajar buat tka dulu bingung banget atau harus belajar buat dua duanya tapi nilai raportku juga pas pasan sih
guys besok terkahir ujian SO RELIEVEDDD akhirnya bisa belajar tka utbk 😛💃🏿,guys besok terkahir ujian sok relieved akhirnya bisa belajar tka utbk
Menjelang tka dan utbk ini gw harus menutup hati biar tiba tiba ga goblok karna cinta,menjelang tka dan utbk ini gue harus menutup hati biar tiba tiba tidak goblok karena cinta
Ak bnr bnr ngehindar bgt dr kimia di tka tp JURUSAN YG AK MAU KIMIA TUH DIBUTUHIN BGTT😩😩😩 aku takut gbs soalnya aku tuh kurang paham sama soal soal kimia😫😫😫,aku benar benar ngehindar banget dari kimia di tka tapi jurusan yang aku mau kimia tuh dibutuhin banget aku takut tidak bisa soalnya aku tuh kurang paham sama soal soal kimia
teman-temannn.. adakah yang punya rekomendasi channel ytb buat belajar tka?? tia yaa!,temanteman adakah yang punya rekomendasi channel ytb buat belajar tka tia ya
"door, siapa disini yang kelas 11 mauk naik kelas 12? PUSING DEH GUA MIKIRIN TKA",door siapa disini yang kelas mauk naik kelas pusing deh gua memikirkan tka
Apa sih tka gua udah SMA bukan TKA,apa sih tka gua sudah sama bukan tka
yang udah sm unair dan milih tka nya biokim review dongg 🥹,yang sudah sama unair dan memilih tka nya biokim review dong
"mau nanyaa dongg, tka tuh mapel pilihannya satu atau dua yaa? aku bingung mau beli buku tka yy saintek apa soshum, soalnya kalo 2 rencananya mau ambil matmin sama ekoo (emg kelas aku campur ipa ips😇) makasii banyakk sebelumnyaa",mau nanyaa dong tka tuh mata pelajaran pilihannya satu atau dua ya aku bingung mau beli buku tka yy saintek apa soshum soalnya kalau rencananya mau ambil matmin sama ekoo memang kelas aku campur ipa ips makasii banyakk sebelumnyaa
bingung mau belajar TKA darimanaaa,bingung mau belajar tka darimana
gw nih butuh sosialisasi tka dah,gue nih butuh sosialisasi tka sudah
guys kalo tka saintek mending gercep apa eksplorasi ya?,guys kalau tka saintek mending gercep apa eksplorasi ya
Lebih kena mental ngerjain TO TKA daripada TO UTBK🥲😔,lebih kena mental ngerjain try out tka daripada try out utbk
reminder aja H-146 TKA,reminder saja h tka
YA ALLAH 😭😭😭😭😭😭😭 INI NYEMANGATIN AKU MAU TKA BESOK YA,ya allah ini nyemangatin aku mau tka besok ya
"ini bocah ips udh pada banyak yg belajar utbk tka meanwhile ipa masih kebantai sama ujian mafiki, bjir. dayyumnn",ini bocah ips sudah pada banyak yang belajar utbk tka meanwhile ipa masih kebantai sama ujian mafiki bjir dayyumnn
moots yg udah TO TKA di rg siapaaa? aku mau tanya2 buat aksesnya beli atau gimana yaah?,moots yang sudah try out tka di rg siapa aku mau tanya buat aksesnya beli atau bagaimana ya
"kasian ih adik kelas ak hrs brngkt jam 6.30, gaboleh bawa kendaraan, ada un, ada tka, anak sekolah di jabar gaboleh pulang malem...",kasihan ih adik kelas aku harus brngkt jam gaboleh bawa kendaraan ada un ada tka anak sekolah di jabar gaboleh pulang malam
kemarin aku engga belajar huftt... cape banget kemarin ulangan lisan &amp; praktik 4 jam PUNGGUNG AKU SAKITTTy____y jadi engga belajar deh:[ niatnya kemarin malam mau start tka😣,kemarin aku tidak belajar huftt capek banget kemarin ulangan lisan   praktik jam punggung aku sakityy jadi tidak belajar deh niatnya kemarin malam mau start tka
tumbang guys abis menghadapi TO TKA kemarin,tumbang guys habis menghadapi try out tka kemarin
Nanti mau start belajar TKA🤚🏻 mapel apa dulu enaknya?,nanti mau start belajar tka mata pelajaran apa dulu enaknya
Karna udh lama ga nyentuh fisika nih ide bagus klo temen² ada yg mau nanya soal fisika tka ujian mandiri apa pun👌,karena sudah lama tidak nyentuh fisika nih ide bagus kalau teman ada yang mau bertanya soal fisika tka ujian mandiri apa pun
"kalo tkakan masuk nanti eligible yaa? berarti aku yang anak ips gabisa milih jurusan seperti sastra ataupun jurusan yang mengarah ke ipa yaa?? jujur baru kepikiran ini pas mau beli buku tka😭😭, jadi untuk ituu aku ambilnya buku tka ipskah?",kalau tkakan masuk nanti eligible ya berarti aku yang anak ips tidak bisa memilih jurusan seperti sastra ataupun jurusan yang mengarah ke ipa ya jujur baru kepikiran ini pas mau beli buku tka jadi untuk itu aku ambilnya buku tka ipskah
"to do list akt 26 :
1. belajar buat osn-k 
2. belajar TKA 
3. belajar utbk 
4. makan dan tidur (opsional)",try out di list angkatan belajar buat osnk belajar tka belajar utbk makan dan tidur opsional
TKA 50 soal 50 menit 💀☠️,tka soal menit
"teman timun 26, kalian tka yg ambil mapel pilihan ekonomi sama mtl beli buku tidak??",teman timun kalian tka yang ambil mata pelajaran pilihan ekonomi sama mtl beli buku tidak
"CARA NOLAK BIAR GA JADI KETUA KELOMPOK P5 GIMANAAA??!?!
soalnya aku 2 tahun selalu jadi ketua kelompok, terus bulan ini hectic banget sama lomba lomba dan belum lagi belajar TKA",cara nolak biar tidak jadi ketua kelompok p bagaimana soalnya aku tahun selalu jadi ketua kelompok terus bulan ini hectic banget sama lomba lomba dan belum lagi belajar tka
liburan kali ini gak kayak liburan (latihan lomba &amp; BELAJAR UTBK TKA 😓😓😓😓😓😓😓),liburan kali ini tidak kayak liburan latihan lomba   belajar utbk tka
Kalian yg belajar tka khususnya mapel kimia itu dari mana materinyaa???,kalian yang belajar tka khususnya mata pelajaran kimia itu dari mana materinyaa
"✨️ rate soal simulasi tka hari ini ✨️

- b.indo 7/10 : jujurr bingungin banget karna jawabannya mirip"". kebanyakan disuruh cari informasi berdasarkan teks (simpulan, inti kalimat, pernyataan benar salah)",rate soal simulasi tka hari ini bindo jujurr bingungin banget karena jawabannya mirip kebanyakan disuruh cari informasi berdasarkan teks simpulan inti kalimat pernyataan benar salah
ujian TKA ni kalau kuliahnya keluar negeri dipake kaga ya,ujian tka nih kalau kuliahnya keluar negeri dipakai kagak ya
TKA ini materinya dari kls 10 sampai 12 apa cuma sampai kelas 11 aja?,tka ini materinya dari kelas sampai apa cuma sampai kelas saja
buku tka yang sangat amat recommend itu yang mana ya,buku tka yang sangat amat recommend itu yang mana ya
"OIYA DI SINI JUAL LATIHAN TO TKA+TPS SNBT JUGA. JUAL MATERI TKA SAINTEK FULL INDONESIA, INGGRIS, MATEMATIKA, BIOLOGI, FISIKA, KIMIA. 😇😁",oiya di sini jual latihan try out tkatps snbt juga jual materi tka saintek full indonesia inggris matematika biologi fisika kimia
mending beli buku TKA atau LANGGANAN RUANG GURU?!?! saranin dong best🥹🥲😭,mending beli buku tka atau langganan ruang guru menyarankan dong best
"CLOSED YA🤩

Stay tune untuk pengumumannya ya, good luck all🥳",closed ya stay tune untuk pengumumannya ya good luck all
"guys saranin buku tka yang isinya kebanyakan materi dong, aku udh beli eksplorasi sama gercep ternyata isinya latihan soal semua",guys menyarankan buku tka yang isinya kebanyakan materi dong aku sudah beli eksplorasi sama gercep ternyata isinya latihan soal semua
beneran bakal ada tka nih,benaran bakal ada tka nih
kalo gk eligible tetap bisa ikut tka gk ya?,kalau tidak eligible tetap bisa ikut tka tidak ya
"gusy, nilai tka itu untuk snbp aja kan bukan untuk penentu nilai lulus ?",guys nilai tka itu untuk snbp saja kan bukan untuk penentu nilai lulus
untung aku 2025 ya Allah gada tka,untung aku ya allah tidak ada tka
Ada rekomen buku TKA?,ada rekomen buku tka
"p5, hapalan, utbk, tka.. mampus bgt",p hapalan utbk tka mampus banget
guys tka tuh ngaruh eligible gak,guys tka tuh ngaruh eligible tidak
mau beli buku tp lagi saving money buat study tour 🧍🏻‍♀️ adakah ch yg bisa buat mulai belajar TKA or UTBK yh teman-teman?,mau beli buku tapi lagi saving money buat study tour adakah ch yang bisa buat mulai belajar tka atau utbk ya temanteman
"let's make a study plans (semoga gk omdo):
1. sebulan kedepan (selama libur semester) &gt;&gt; HSK 1
2. sebulan setelahnya &gt;&gt; HSK 2
3. after HSK 2 until test TKA &gt;&gt; belajar buat TKA + SNBT (focused on TKA)

akan ku lihat toxic motivation utk penyemangat... 😇",lets memakai a study plans semoga tidak omong doang sebulan kedepan selama libur semester gtgt hsk sebulan setelahnya gtgt hsk after hsk until test tka gtgt belajar buat tka snbt focused on tka akan ku lihat toxic motivation untuk penyemangat
HABIS GW ULTAH HADIAHNYA TKA😭,habis gue ultah hadiahnya tka
H-144 tka :( bia gak ya aku...,h tka bia tidak ya aku
"ak angkatan 2027, and i've seen thiss beforee, and i think buat TKA sendiri for ang ²⁷  fokusin belajar mapel di sekolah ajaa teman temann! sama sering sering review mapel also drill soal ajaaa, jadi belajarnya ga terasa beratt!",aku angkatan and ive seen thiss beforee and i think buat tka sendiri for ang fokusin belajar mata pelajaran di sekolah saja teman temann sama sering sering review mata pelajaran also drill soal saja jadi belajarnya tidak terasa beratt
semangat belajar tka dan mandirinya bubub-bubub 🩷🩷🩷,semangat belajar tka dan mandirinya bububbubub
"buset siapa yang ngusulin tka sih, ribet bgt woi 😹😹😹",buset siapa yang ngusulin tka sih ribet banget woi
TKA sama aja kaya ulangan gasih,tka sama saja kaya ulangan tidak sih
semoga TKA nanti lebih gampang daripada to to 🙏🏻,semoga tka nanti lebih gampang daripada try out try out
di x gada komunitas TKA ya?,di kali tidak ada komunitas tka ya
kalian belajar TKA ngulang materi kls 10 lagi kah bubss?,kalian belajar tka ngulang materi kelas lagi kah bubss
gw langsunh tkb apaitu tka,gue langsunh tkb apaitu tka
"ni sekolah ku mantep banget
osk ga ada bimbingan (ga tau belum atau emang tahun ini ga ada), TKA blm ada info yg jelas (bahkan keknya blm diinfoin samsek). tapi untungnya aku join studitwit bro, I love tman2 studitwit ku 😔🫰🫰🫰🌟🌟",nih sekolah ku mantap banget osk tidak ada bimbingan tidak tau belum atau memang tahun ini tidak ada tka belum ada info yang jelas bahkan kayaknya belum diinfoin samsek tapi untungnya aku join studitwit bro i love teman studitwit ku
tka pake kertas aja pls‼️‼️udh kalah di rapot aja pls jgn kalah di tka😞,tka pakai kertas saja plsudh kalah di rapot saja tolong jangan kalah di tka
deymm pusing bener mikirin pekael ditambah lagi ntar sistem tka,deymm pusing benar memikirkan pekael ditambah lagi entar sistem tka
pengen juga to tka 😭😭😭😭 tp ver smk aja,pengin juga try out tka tapi ver smk saja
"Eh kok udah banyak yg simulasi TKA dari sekolahnya, sekolah aku blm ngasih tau apapun tentang TKA 😭😭",eh kok sudah banyak yang simulasi tka dari sekolahnya sekolah aku belum mengasih tau apapun tentang tka
Alhamdulillah ya Allah ya Rabbi akhirnya ASAT + TO TKA itu uda selesaiiiiii,alhamdulillah ya allah ya rabbi akhirnya asat try out tka itu sudah selesai
